Site UID,Site URL,Site Human-Readable Name,Policy UID,Site Check Date,In 115 Set?,Comments,Sectoral Data,,,,,,,,,,,,,,,,,,,,,,,,,,,,,,,,,,,,,,,,,,,,,,,,,,,,,,,,,,,,,,,,,,,,,,,,,,,,,,,,,,,,,,,,,,,,,,,,,,,
70,ideas.repec.org,St. Louis Federal Reserve,928,2016-02-08,Yes,"Alexa Rank: 24114 (Global), 14361 (US)",Regional: Asia: Japan: Society and Culture: History,Business: News and Media: Research Reports,Computers: Hardware: Peripherals: Keyboards: Layouts: Dvorak,Science: Social Sciences: Economics,Science: Social Sciences: Economics: Econometrics: Publications,Science: Social Sciences: Economics: Econometrics: Software: Routines,Science: Social Sciences: Economics: Evolutionary Economics,"Science: Social Sciences: Economics: People: Fogel, Robert W","Science: Social Sciences: Economics: People: Mas-Colell, Andreu","Science: Social Sciences: Economics: People: Meltzer, Allan","Science: Social Sciences: Economics: People: Viner, Jacob",Society: Issues: Poverty: Causes,Society: Issues: Territorial Disputes: Spain: Catalonia,,,,,,,,,,,,,,,,,,,,,,,,,,,,,,,,,,,,,,,,,,,,,,,,,,,,,,,,,,,,,,,,,,,,,,,,,,,,,,,,,,,,,,,
71,wikitravel.org,Internet Brands,940,2016-02-08,Yes,"Alexa Rank: 6091 (Global), 6278 (US)",Recreation: Travel: Guides and Directories,Recreation: Travel: Preparation: Tips,Regional: Africa: Egypt: Travel and Tourism: Travel Guides,Regional: Africa: Namibia: Localities: Lüderitz,Regional: Africa: South Sudan: Travel and Tourism,Regional: Africa: Travel and Tourism: Travel Guides,Regional: Africa: Zambia: Science and Environment: National Parks: South Luangwa National Park,Regional: Africa: Zambia: Travel and Tourism: Travel Guides,Regional: Africa: Zimbabwe: Localities: Mashonaland East: Harare: Travel and Tourism,Regional: Africa: Zimbabwe: Travel and Tourism: Travel Guides,Regional: Asia: China: Shanghai: Travel and Tourism: Travel Guides,Regional: Asia: Georgia: Mtskheta-Mtianeti,Regional: Asia: Georgia: Shida Kartli: Gori,Regional: Asia: India: Himachal Pradesh: Localities: Manali: Travel and Tourism,Regional: Asia: India: Travel and Tourism: Travel Guides,Regional: Asia: Japan: Prefectures: Miyagi: Travel and Tourism,Regional: Asia: Laos: Travel and Tourism: Travel Guides,Regional: Asia: Thailand: Provinces: Bangkok: Travel and Tourism: Travel Guides,Regional: Asia: Vietnam: Provinces: Hanoi: Hanoi: Travel and Tourism: Travel Guides,Regional: Asia: Vietnam: Provinces: Ho Chi Minh: Ho Chi Minh City: Travel and Tourism,Regional: Asia: Vietnam: Provinces: Quang Nam: Hoi An: Travel and Tourism,Regional: Asia: Vietnam: Travel and Tourism: Travel Guides,Regional: Europe: Belgium: Regions: Brussels: Guides and Directories,Regional: Europe: Estonia: Harjumaa: Tallinn: Travel and Tourism: Travel Guides,Regional: Europe: Estonia: Travel and Tourism: Travel Guides,Regional: Europe: France: Regions: Provence-Alpes-Cote d'Azur: Alpes-Maritimes: Localities: Cannes: Travel and Tourism: Travel Guides,Regional: Europe: Italy: Regions: Lazio: Localities: Rome: Travel and Tourism: Travel Guides,Regional: Europe: Italy: Travel and Tourism,Regional: Europe: Russia: Administrative Regions: Krasnodar Krai: Sochi: Travel and Tourism,Regional: Europe: Slovakia: Localities: Bratislava: Travel and Tourism: Travel Guides,Regional: Europe: Spain: Autonomous Communities: Aragon: Zaragoza,Regional: Europe: Ukraine: Provinces: Kyiv Oblast: Kyiv: Travel and Tourism: Travel Guides,Regional: Europe: United Kingdom: England: Berkshire: Windsor: Travel and Tourism,Regional: Europe: United Kingdom: England: Cleveland: Middlesbrough: Travel and Tourism,Regional: Europe: United Kingdom: England: West Midlands: Birmingham: Guides and Directories,Regional: Middle East: Iran: Travel and Tourism: Travel Guides,Regional: Middle East: Israel: Localities: Nazareth: Travel and Tourism,Regional: North America: United States: Government: Agencies: Independent: National Railroad Passenger Corporation - Amtrak,Regional: North America: United States: Mississippi: Localities: O: Oxford: Travel and Tourism,Regional: North America: United States: Nevada: Arts and Entertainment: Events: Burning Man,"Regional: North America: United States: Washington, DC: Neighborhoods: Adams Morgan","Regional: North America: United States: Washington, DC: Neighborhoods: Anacostia","Regional: North America: United States: Washington, DC: Neighborhoods: Capitol Hill","Regional: North America: United States: Washington, DC: Neighborhoods: Cardozo-Shaw","Regional: North America: United States: Washington, DC: Neighborhoods: Dupont Circle","Regional: North America: United States: Washington, DC: Neighborhoods: Georgetown","Regional: North America: United States: Washington, DC: Neighborhoods: Penn Quarter","Regional: North America: United States: Washington, DC: Neighborhoods: West End","Regional: North America: United States: Washington, DC: Travel and Tourism: Travel Guides",Regional: Oceania: Cocos Islands: Travel and Tourism,Regional: Oceania: French Polynesia: Travel and Tourism: Travel Guides,"Regional: Oceania: Micronesia, Federated States of: Travel and Tourism",Regional: Oceania: New Caledonia: Travel and Tourism: Travel Guides,Regional: Oceania: Niue: Travel and Tourism,Regional: Oceania: Norfolk Island: Travel and Tourism,Regional: Oceania: Papua New Guinea: Travel and Tourism: Travel Guides,Regional: Oceania: Pitcairn Islands: Travel and Tourism,Regional: Oceania: Solomon Islands: Travel and Tourism: Travel Guides,Regional: South America: Brazil: States: Ceará: Travel and Tourism: Travel Guides,Regional: South America: Brazil: States: Paraíba: Travel and Tourism,Science: Social Sciences: Linguistics: Languages: Natural: Pidgins and Creoles: English Based: Tok Pisin,World: Català: Lleure: Turisme,World: Deutsch: Freizeit: Reisen: Bahnreisen: Transsibirische Eisenbahn,World: Deutsch: Regional: Afrika: Ägypten: Reise und Tourismus,World: Deutsch: Regional: Amerika: Vereinigte Staaten: Hawaii: Reise und Tourismus,World: Deutsch: Regional: Amerika: Vereinigte Staaten: New York: Orte: New York: Tourismus,World: Deutsch: Regional: Amerika: Vereinigte Staaten: Reise und Tourismus,World: Deutsch: Regional: Asien: China: Hongkong,World: Deutsch: Regional: Asien: Jordanien,World: Deutsch: Regional: Asien: Thailand: Bangkok,World: Deutsch: Regional: Europa: Finnland: Reise und Tourismus,World: Deutsch: Regional: Europa: Polen: Ermland und Masuren: Landkreise: Elk: Städte und Gemeinden: Elk,World: Deutsch: Regional: Europa: Polen: Podlachien: Landkreise: Bialystok: Städte und Gemeinden: Suprasl,World: Deutsch: Regional: Europa: Schweden: Stockholm,World: Deutsch: Regional: Europa: Serbien,World: Deutsch: Regional: Europa: Spanien: Kanarische Inseln: Gran Canaria: Reise und Tourismus,World: Deutsch: Regional: Europa: Spanien: Kanarische Inseln: Reise und Tourismus,World: Deutsch: Regional: Europa: Vereinigtes Königreich: England: Städte: London,World: Deutsch: Wissen: Wörterbücher: Sprachen: Japanisch,World: Esperanto: Distriĝo: Turismo,World: Français: Loisirs: Voyage: Guides et répertoires,World: Français: Régional: Afrique: Afrique du Sud: Voyages et tourisme,World: Français: Régional: Afrique: Algérie: Voyages et tourisme,World: Français: Régional: Afrique: Cameroun: Voyages et tourisme,World: Français: Régional: Asie: Hong Kong: Voyages et tourisme,World: Français: Régional: Europe: France: Régions: Nord-Pas-de-Calais: Nord: Villes et villages: Lille: Voyages et tourisme,World: Français: Régional: Europe: France: Régions: Nord-Pas-de-Calais: Nord: Villes et villages: Roubaix: Voyages et tourisme,World: Français: Régional: Europe: Malte: Voyages et tourisme,World: Français: Régional: Océanie: Australie: Voyages et tourisme,World: Hindi: मनोरंजन,World: Italiano: Regionale: America del Nord: Stati Uniti: Florida: Miami,World: Italiano: Regionale: America del Sud: Brasile: Turismo,World: Polski: Regionalne: Azja: Japonia,World: Português: Passatempos: Viagens,World: Português: Regional: África: Marrocos,World: Română: Recreaţie: Turism,World: Suomi: Vapaa-aika: Matkailu,,,
72,lynda.com,Lynda,962,2016-02-08,Yes,"Alexa Rank: 1159 (Global), 748 (US)",Computers: Graphics: Web: Colors,Computers: Internet: Web Design and Development: Authoring: Style and Design,"Computers: Internet: Web Design and Development: FAQs, Help, and Tutorials",,,,,,,,,,,,,,,,,,,,,,,,,,,,,,,,,,,,,,,,,,,,,,,,,,,,,,,,,,,,,,,,,,,,,,,,,,,,,,,,,,,,,,,,,,,,,,,,,
73,solarviews.com,Solar Views,988,2016-02-08,Yes,"Alexa Rank: 347632 (Global), 145671 (US)",Science: Technology: Space: Missions: Unmanned: Mars: Mariner,Kids and Teens: International: Español: Actividades escolares: Ciencia y tecnología: Astronomía y espacio: Sistema Solar: Planetas: Júpiter,Kids and Teens: International: Español: Actividades escolares: Ciencia y tecnología: Astronomía y espacio: Sistema Solar: Planetas: Júpiter: Satélites: Adrastea,Kids and Teens: International: Español: Actividades escolares: Ciencia y tecnología: Astronomía y espacio: Sistema Solar: Planetas: Júpiter: Satélites: Europa,Kids and Teens: International: Español: Actividades escolares: Ciencia y tecnología: Astronomía y espacio: Sistema Solar: Planetas: Júpiter: Satélites: Io,Kids and Teens: International: Español: Actividades escolares: Ciencia y tecnología: Astronomía y espacio: Sistema Solar: Planetas: Marte,Kids and Teens: International: Español: Actividades escolares: Ciencia y tecnología: Astronomía y espacio: Sistema Solar: Planetas: Marte: Satélites: Deimos,Kids and Teens: International: Español: Actividades escolares: Ciencia y tecnología: Astronomía y espacio: Sistema Solar: Planetas: Marte: Satélites: Fobos,Kids and Teens: International: Español: Actividades escolares: Ciencia y tecnología: Astronomía y espacio: Sistema Solar: Planetas: Mercurio,Kids and Teens: International: Español: Actividades escolares: Ciencia y tecnología: Astronomía y espacio: Sistema Solar: Planetas: Neptuno,Kids and Teens: International: Español: Actividades escolares: Ciencia y tecnología: Astronomía y espacio: Sistema Solar: Planetas: Neptuno: Satélites: Despina,Kids and Teens: International: Español: Actividades escolares: Ciencia y tecnología: Astronomía y espacio: Sistema Solar: Planetas: Neptuno: Satélites: Galatea,Kids and Teens: International: Español: Actividades escolares: Ciencia y tecnología: Astronomía y espacio: Sistema Solar: Planetas: Neptuno: Satélites: Larisa,Kids and Teens: International: Español: Actividades escolares: Ciencia y tecnología: Astronomía y espacio: Sistema Solar: Planetas: Neptuno: Satélites: Nereida,Kids and Teens: International: Español: Actividades escolares: Ciencia y tecnología: Astronomía y espacio: Sistema Solar: Planetas: Neptuno: Satélites: Náyade,Kids and Teens: International: Español: Actividades escolares: Ciencia y tecnología: Astronomía y espacio: Sistema Solar: Planetas: Neptuno: Satélites: Thalassa,Kids and Teens: International: Español: Actividades escolares: Ciencia y tecnología: Astronomía y espacio: Sistema Solar: Planetas: Saturno,Kids and Teens: International: Español: Actividades escolares: Ciencia y tecnología: Astronomía y espacio: Sistema Solar: Planetas: Tierra,Kids and Teens: International: Español: Actividades escolares: Ciencia y tecnología: Astronomía y espacio: Sistema Solar: Planetas: Tierra: Luna,Kids and Teens: International: Español: Actividades escolares: Ciencia y tecnología: Astronomía y espacio: Sistema Solar: Planetas: Urano,Kids and Teens: International: Español: Actividades escolares: Ciencia y tecnología: Astronomía y espacio: Sistema Solar: Planetas: Urano: Satélites: Ariel,Kids and Teens: International: Español: Actividades escolares: Ciencia y tecnología: Astronomía y espacio: Sistema Solar: Planetas: Urano: Satélites: Belinda,Kids and Teens: International: Español: Actividades escolares: Ciencia y tecnología: Astronomía y espacio: Sistema Solar: Planetas: Urano: Satélites: Bianca,Kids and Teens: International: Español: Actividades escolares: Ciencia y tecnología: Astronomía y espacio: Sistema Solar: Planetas: Urano: Satélites: Cordelia,Kids and Teens: International: Español: Actividades escolares: Ciencia y tecnología: Astronomía y espacio: Sistema Solar: Planetas: Urano: Satélites: Crésida,Kids and Teens: International: Español: Actividades escolares: Ciencia y tecnología: Astronomía y espacio: Sistema Solar: Planetas: Urano: Satélites: Desdémona,Kids and Teens: International: Español: Actividades escolares: Ciencia y tecnología: Astronomía y espacio: Sistema Solar: Planetas: Urano: Satélites: Julieta,Kids and Teens: International: Español: Actividades escolares: Ciencia y tecnología: Astronomía y espacio: Sistema Solar: Planetas: Urano: Satélites: Oberón,Kids and Teens: International: Español: Actividades escolares: Ciencia y tecnología: Astronomía y espacio: Sistema Solar: Planetas: Urano: Satélites: Ofelia,Kids and Teens: International: Español: Actividades escolares: Ciencia y tecnología: Astronomía y espacio: Sistema Solar: Planetas: Urano: Satélites: Porcia,Kids and Teens: International: Español: Actividades escolares: Ciencia y tecnología: Astronomía y espacio: Sistema Solar: Planetas: Urano: Satélites: Puck,Kids and Teens: International: Español: Actividades escolares: Ciencia y tecnología: Astronomía y espacio: Sistema Solar: Planetas: Urano: Satélites: Rosalinda,Kids and Teens: International: Español: Actividades escolares: Ciencia y tecnología: Astronomía y espacio: Sistema Solar: Planetas: Urano: Satélites: Titania,Kids and Teens: International: Español: Actividades escolares: Ciencia y tecnología: Astronomía y espacio: Sistema Solar: Planetas: Urano: Satélites: Umbriel,Kids and Teens: International: Español: Actividades escolares: Ciencia y tecnología: Astronomía y espacio: Sistema Solar: Planetas: Venus,Kids and Teens: International: Español: Actividades escolares: Ciencia y tecnología: Astronomía y espacio: Sistema Solar: Planetas enanos: Plutón y Caronte,Kids and Teens: International: Español: Tiempo de escuela: Ciencia y tecnología: Astronomía y espacio,Kids and Teens: International: Español: Tiempo de escuela: Ciencia y tecnología: Astronomía y espacio: Sistema Solar,Kids and Teens: International: Español: Tiempo de escuela: Ciencia y tecnología: Astronomía y espacio: Sistema Solar: Sol,Kids and Teens: International: Français: Scolaire: Sciences: Astronomie et espace,Kids and Teens: International: Português: Atividades Escolares: Ciência,Kids and Teens: School Time: Science: Astronomy and Space: Images from Space,Kids and Teens: School Time: Science: Astronomy and Space: Solar System,"Kids and Teens: School Time: Science: Astronomy and Space: Solar System: Asteroids, Comets, and Meteors: Asteroids",Kids and Teens: School Time: Science: Astronomy and Space: Solar System: Earth,Kids and Teens: School Time: Science: Astronomy and Space: Solar System: Earth: Moon,Regional: North America: Mexico: Science and Environment: Earth Sciences,Science: Astronomy: Solar System,Science: Astronomy: Solar System: Dwarf Planets: Pluto and Charon,Science: Astronomy: Solar System: Oort Cloud,Science: Astronomy: Solar System: Planets: Earth,Science: Astronomy: Solar System: Planets: Jupiter,Science: Astronomy: Solar System: Planets: Jupiter: Moons: Callisto,Science: Astronomy: Solar System: Planets: Jupiter: Moons: Europa,Science: Astronomy: Solar System: Planets: Jupiter: Moons: Ganymede,Science: Astronomy: Solar System: Planets: Jupiter: Moons: Himalia,Science: Astronomy: Solar System: Planets: Jupiter: Moons: Io,Science: Astronomy: Solar System: Planets: Mars,Science: Astronomy: Solar System: Planets: Mars: Moons: Deimos,Science: Astronomy: Solar System: Planets: Mars: Moons: Phobos,Science: Astronomy: Solar System: Planets: Mercury,Science: Astronomy: Solar System: Planets: Neptune,Science: Astronomy: Solar System: Planets: Saturn,Science: Astronomy: Solar System: Planets: Uranus,Science: Astronomy: Solar System: Planets: Venus,Science: Astronomy: Solar System: Small Bodies: Asteroids,Science: Astronomy: Solar System: Small Bodies: Comets,Science: Astronomy: Solar System: Small Bodies: Meteors,Science: Astronomy: Solar System: Sun,Science: Earth Sciences: Geology: Geomorphology: Impact Craters,Science: Technology: Space: Missions,Science: Technology: Space: Missions: Manned: United States: Apollo,Science: Technology: Space: Missions: Unmanned: Mars: Mars Global Surveyor,Science: Technology: Space: Missions: Unmanned: Mars: Mars Pathfinder,Science: Technology: Space: Missions: Unmanned: Mars: Nozomi,Science: Technology: Space: Missions: Unmanned: Mars: Phobos,Science: Technology: Space: Missions: Unmanned: Mars: Viking,Science: Technology: Space: Missions: Unmanned: Moon: Lunar Orbiter,Science: Technology: Space: Missions: Unmanned: Outer Solar System: Cassini,Science: Technology: Space: Missions: Unmanned: Outer Solar System: Galileo,Society: History: By Topic: Exploration: Space,World: Deutsch: Wissenschaft: Naturwissenschaften: Astronomie: Sonnensystem,World: Deutsch: Wissenschaft: Naturwissenschaften: Astronomie: Sonnensystem: Asteroiden,World: Español: Ciencia y tecnología: Astronomía: Sistema Solar: Planetas: Júpiter,World: Español: Ciencia y tecnología: Astronomía: Sistema Solar: Planetas: Júpiter: Satélites: Adrastea,World: Español: Ciencia y tecnología: Astronomía: Sistema Solar: Planetas: Júpiter: Satélites: Europa,World: Español: Ciencia y tecnología: Astronomía: Sistema Solar: Planetas: Júpiter: Satélites: Io,World: Español: Ciencia y tecnología: Astronomía: Sistema Solar: Planetas: Marte,World: Español: Ciencia y tecnología: Astronomía: Sistema Solar: Planetas: Marte: Satélites: Deimos,World: Español: Ciencia y tecnología: Astronomía: Sistema Solar: Planetas: Marte: Satélites: Fobos,World: Español: Ciencia y tecnología: Astronomía: Sistema Solar: Planetas: Mercurio,World: Español: Ciencia y tecnología: Astronomía: Sistema Solar: Planetas: Neptuno,World: Español: Ciencia y tecnología: Astronomía: Sistema Solar: Planetas: Neptuno: Satélites: Despina,World: Español: Ciencia y tecnología: Astronomía: Sistema Solar: Planetas: Neptuno: Satélites: Galatea,World: Español: Ciencia y tecnología: Astronomía: Sistema Solar: Planetas: Neptuno: Satélites: Larisa,World: Español: Ciencia y tecnología: Astronomía: Sistema Solar: Planetas: Neptuno: Satélites: Nereida,World: Español: Ciencia y tecnología: Astronomía: Sistema Solar: Planetas: Neptuno: Satélites: Náyade,World: Español: Ciencia y tecnología: Astronomía: Sistema Solar: Planetas: Neptuno: Satélites: Thalassa,World: Español: Ciencia y tecnología: Astronomía: Sistema Solar: Planetas: Saturno,World: Español: Ciencia y tecnología: Astronomía: Sistema Solar: Planetas: Saturno: Satélites: Helena
74,mohegansun.com,Mohegan Sun,995,2016-02-08,Yes,"Alexa Rank: 74914 (Global), 13437 (US)",Games: Gambling: Casinos: By Location: North America: United States: Connecticut,Regional: North America: United States: Connecticut: Localities: M: Montville,,,,,,,,,,,,,,,,,,,,,,,,,,,,,,,,,,,,,,,,,,,,,,,,,,,,,,,,,,,,,,,,,,,,,,,,,,,,,,,,,,,,,,,,,,,,,,,,,,
75,sci-news.com,Sci-News,1017,2016-02-08,Yes,"Alexa Rank: 57628 (Global), 17479 (US)",Science: News and Media: Breaking News,,,,,,,,,,,,,,,,,,,,,,,,,,,,,,,,,,,,,,,,,,,,,,,,,,,,,,,,,,,,,,,,,,,,,,,,,,,,,,,,,,,,,,,,,,,,,,,,,,,
76,redorbit.com,Red Orbit,1028,2016-02-08,Yes,"Alexa Rank: 34035 (Global), 10840 (US)",Science: News and Media,,,,,,,,,,,,,,,,,,,,,,,,,,,,,,,,,,,,,,,,,,,,,,,,,,,,,,,,,,,,,,,,,,,,,,,,,,,,,,,,,,,,,,,,,,,,,,,,,,,
77,autoblog.com,Autoblog,1034,2016-02-08,Yes,"Alexa Rank: 2098 (Global), 870 (US)",Home: Consumer Information: Automobiles: Purchasing: By Make: Lamborghini,"Arts: Movies: Titles: B: Batman Series: Dark Knight, The: Articles and Interviews",Home: Consumer Information: Automobiles: Purchasing: By Make: Aston Martin,Home: Consumer Information: Automobiles: Purchasing: By Make: Audi,Home: Consumer Information: Automobiles: Purchasing: By Make: Audi: Used,Home: Consumer Information: Automobiles: Purchasing: By Make: Buick,Home: Consumer Information: Automobiles: Purchasing: By Make: Buick: Used,Home: Consumer Information: Automobiles: Purchasing: By Make: Jaguar,Home: Consumer Information: Automobiles: Purchasing: By Make: Jaguar: Used,Home: Consumer Information: Automobiles: Purchasing: By Make: Kia,Home: Consumer Information: Automobiles: Purchasing: By Make: Kia: Used,Home: Consumer Information: Automobiles: Purchasing: By Make: Saab,Recreation: Autos: Driving and Safety,Recreation: Autos: Enthusiasts,Recreation: Autos: Enthusiasts: Concept Vehicles,Recreation: Autos: Magazines and E-zines: Weblogs,Recreation: Autos: Makes and Models: Geo,Recreation: Autos: Makes and Models: International Harvester: Trucks,Recreation: Autos: Makes and Models: Maserati,Recreation: Autos: Makes and Models: Mini,Recreation: Autos: Makes and Models: Morgan,Recreation: Autos: Makes and Models: Saleen,Shopping: Vehicles: Autos: Internet Sales,Society: Issues: Science and Technology: Cell Phones: Cell Phones and Driving,,,,,,,,,,,,,,,,,,,,,,,,,,,,,,,,,,,,,,,,,,,,,,,,,,,,,,,,,,,,,,,,,,,,,,,,,,,,
78,honda.com,Honda,1050,2016-02-08,Yes,"Alexa Rank: 3525 (Global), 886 (US)",Recreation: Autos: Makes and Models: Honda,Recreation: Autos: Makes and Models: Honda: Civic,Recreation: Motorcycles: Makes and Models: Honda,Kids and Teens: School Time: Science: Technology: Machines: Cars and Trucks,Business: Automotive,Business: Automotive: Motorcycles: Makes and Models,Business: Automotive: Motorcycles: Scooters: Manufacturing,Business: Consumer Goods and Services: Home and Garden: Lawn and Garden: Tools and Equipment: Power Tools,Computers: Robotics: Robots,Recreation: Autos: Makes and Models: Honda: Accord,Recreation: Autos: Makes and Models: Honda: CR-V,Recreation: Autos: Makes and Models: Honda: Fit,Recreation: Autos: Makes and Models: Honda: Odyssey,Regional: Africa: Nigeria: Business and Economy: Motoring,Regional: Asia: Japan: Business and Economy: Automotive,Regional: Asia: Pakistan: Business and Economy: Automotive,Regional: Asia: Singapore: Business and Economy: Automotive,Regional: North America: United States: California: Counties: Los Angeles: Business and Economy: Automotive,Regional: North America: United States: California: Localities: W: Whittier: Business and Economy: Automotive,Regional: North America: United States: Colorado: Localities: C: Centennial: Business and Economy,Regional: North America: United States: Texas: Metro Areas: Houston-Galveston: Business and Economy: Automotive,Regional: North America: United States: Vermont: Localities: B: Berlin: Business and Economy,Regional: Oceania: Australia: Business and Economy: Automotive: Makes and Models,Science: Technology: Energy: Transportation: Electric Vehicles: Hydrogen,Sports: Motorsports: Auto Racing: Organizations: Indy Racing League: Teams,Sports: Soccer: AFC: Japan,World: Bahasa Indonesia: Bisnis: Otomotif,World: Español: Regional: América: Colombia: Economía y negocios: Industrias: Automotriz,World: Español: Tiempo libre: Autos: Marcas y modelos: Honda,World: Japanese: スポーツ: サッカー: 選手: 日本: は行,World: Japanese: 地域: アジア: 日本: 長崎: 市町村: 雲仙市: ビジネス・経済,World: Română: Afaceri: Vehicule,World: Thai: ภูมิภาค: ทวีปเอเชีย: ประเทศไทย: ภาคตะวันออกเฉียงเหนือ,World: Tiếng Việt: Doanh nghiệp,World: Türkçe: Ekonomi ve İş Dünyası: Otomotiv: Üreticiler ve Distribütörler,,,,,,,,,,,,,,,,,,,,,,,,,,,,,,,,,,,,,,,,,,,,,,,,,,,,,,,,,,,,,,,,,
79,wnep.com,WNEP,1070,2016-02-08,Yes,"Alexa Rank: 39513 (Global), 7396 (US)",Arts: Television: Stations: North America: United States: Pennsylvania,Regional: North America: United States: Pennsylvania: Localities: W: Wilkes-Barre: News and Media,,,,,,,,,,,,,,,,,,,,,,,,,,,,,,,,,,,,,,,,,,,,,,,,,,,,,,,,,,,,,,,,,,,,,,,,,,,,,,,,,,,,,,,,,,,,,,,,,,
80,thecarconnection.com,High Gear Media,1083,2016-02-08,Yes,"Alexa Rank: 11301 (Global), 4378 (US)",Kids and Teens: School Time: Science: Technology: Machines: Cars and Trucks,Recreation: Autos: Magazines and E-zines,,,,,,,,,,,,,,,,,,,,,,,,,,,,,,,,,,,,,,,,,,,,,,,,,,,,,,,,,,,,,,,,,,,,,,,,,,,,,,,,,,,,,,,,,,,,,,,,,,
81,freep.com,Detroit Free Press,1089,2016-02-08,Yes,"Alexa Rank: 2837 (Global), 732 (US)",News: Analysis and Opinion: Columnists: By Publication,News: Newspapers: Regional: United States: Michigan,Regional: Africa: South Africa: Society and Culture: History: Nelson Mandela: News and Media,Regional: North America: United States: Michigan: Localities: D: Detroit: News and Media: Newspapers,Regional: North America: United States: Michigan: Society and Culture: Politics,Sports: Football: American: College and University: NCAA Division I FBS: Big Ten: Michigan: News and Media,Sports: Football: American: NFL: Detroit Lions: News and Media,Sports: Hockey: Ice Hockey: Leagues: National Hockey League: Teams: Detroit Red Wings: News and Media,World: Japanese: アート: ビジュアルアート: ボディアート: タトゥー: スタジオ: 福岡,World: Japanese: 地域: アジア: 日本: 東京: 区: 杉並区: ビジネス・経済: 飲食店,,,,,,,,,,,,,,,,,,,,,,,,,,,,,,,,,,,,,,,,,,,,,,,,,,,,,,,,,,,,,,,,,,,,,,,,,,,,,,,,,,,,,,,,,,
