Site UID,Site URL,Site Human-Readable Name,Policy UID,Site Check Date,In 115 Set?,Comments,Sectoral Data,,,,,,,,,,,,,,,,,,,,,,,,,,,,,,,,,,,,,,,,,,,,,,,,,,,,,,,,,,,,,,,,,,,,,,,,,,,,,,,,,,,,,,,,,,,,,,,,,,,
1,theatlantic.com,The Atlantic,20,2016-02-08,Yes,"Alexa Rank: 975 (Global), 289 (US)","Arts: Literature: Authors: A: Alcott, Louisa May: Works","Arts: Literature: Authors: M: Merwin, W. S.: Works","Arts: Literature: World Literature: American: 19th Century: Longfellow, Henry Wadsworth: Works","Arts: Music: Composition: Composers: T: Toch, Ernst","Arts: Literature: Authors: H: Hemingway, Ernest: Reviews","Arts: Literature: Authors: P: Pinsky, Robert","Regional: North America: United States: Government: Elections: President: 2004: Candidates: Clark, Wesley: News and Media",Regional: North America: United States: Government: Executive Branch: President: POTUS Barack Obama: News and Media,"Science: Social Sciences: Economics: People: Sen, Amartya",Society: Crime: Theft: Art and Antiquities: World War II,Society: History: By Region: Middle East: Kurdistan,"Society: History: By Time Period: Nineteenth Century: People: Brown, John",Society: Issues: Crime and Justice: Prisons: Articles and Publications,"Arts: Architecture: History: Architects: O: Olmsted, Frederick Law","Arts: Art History: Artists: P: Picasso, Pablo","Arts: Art History: Artists: S: Schiele, Egon","Arts: Literature: Authors: A: Alexie, Sherman","Arts: Literature: Authors: A: Amis, Martin","Arts: Literature: Authors: A: Auden, W. H.: Works","Arts: Literature: Authors: B: Barthelme, Frederick","Arts: Literature: Authors: B: Bass, Rick: Works","Arts: Literature: Authors: B: Bidart, Frank","Arts: Literature: Authors: B: Bishop, Elizabeth","Arts: Literature: Authors: B: Bogan, Louise","Arts: Literature: Authors: C: Carver, Raymond: Reviews","Arts: Literature: Authors: D: Doty, Mark","Arts: Literature: Authors: E: Erdrich, Louise","Arts: Literature: Authors: F: Frost, Robert","Arts: Literature: Authors: G: Gallagher, Tess","Arts: Literature: Authors: G: Gioia, Dana","Arts: Literature: Authors: J: James, Henry","Arts: Literature: Authors: K: Kerouac, Jack","Arts: Literature: Authors: L: Levine, Philip","Arts: Literature: Authors: L: Lightman, Alan","Arts: Literature: Authors: M: Merwin, W. S.: Reviews","Arts: Literature: Authors: N: Nabokov, Vladimir: Works: Lolita","Arts: Literature: Authors: O: Ozick, Cynthia","Arts: Literature: Authors: P: Price, Richard","Arts: Literature: Authors: T: Theroux, Paul","Arts: Literature: Authors: T: Thompson, Hunter S.","Arts: Literature: Authors: Y: Yeats, William Butler: Biographies","Arts: Literature: Authors: Y: Yeats, William Butler: Reviews",Arts: Literature: Magazines and E-zines,Arts: Literature: Poetry: Criticism and Theory,"Arts: Literature: Poetry: Poets: M: Matthews, William",Arts: Literature: Reviews and Criticism: Magazines and Newspapers,"Arts: Literature: Short Stories: Contemporary: Krouse, Erika","Arts: Literature: World Literature: American: 19th Century: Emerson, Ralph Waldo: Works","Arts: Literature: World Literature: American: 20th Century: Dickey, James","Arts: Literature: World Literature: British: 17th Century: Jonson, Ben: Works","Arts: Literature: World Literature: British: 19th Century: Beerbohm, Max: Works: Enoch Soames","Arts: Literature: World Literature: British: 19th Century: Eliot, George: Works: Middlemarch","Arts: Literature: World Literature: British: 19th Century: Thackeray, William Makepeace: Works: Vanity Fair",Arts: Literature: World Literature: British: Shakespeare: Authorship,Arts: Literature: World Literature: British: Shakespeare: Authorship: Baconians,Arts: Literature: World Literature: British: Shakespeare: Authorship: Stratfordians,Arts: Literature: World Literature: Canadian: Cultural,"Arts: Movies: Filmmaking: Directing: Directors: L: Lean, David",Arts: Movies: Titles: L: Left Behind,"Arts: Music: Composition: Composers: B: Boulez, Pierre","Arts: Music: Styles: J: Jazz: Bands and Artists: Saxophonists: Coltrane, John","Arts: Music: Styles: J: Jazz: Bands and Artists: Trumpet Players: Davis, Miles: Reviews",Arts: Music: Styles: J: Jazz: History,Arts: Music: Styles: J: Jazz: News and Media: Magazines and E-zines,Arts: Online Writing: Fiction: Short Stories,"Arts: Performing Arts: Acting: Actors and Actresses: B: Brando, Marlon",Arts: Television: Programs: Children's: Sesame Street: International Versions: Street-Ulitsa Sezam,Arts: Writers Resources: Style Guides,Computers: Artificial Intelligence: Philosophy,Computers: E-Books: News and Media,"Computers: Internet: History: People: Barlow, John Perry","Games: Board Games: Abstract: Battle Games: Chess: People: World Champions: Fischer, Bobby",Games: Video Games: Adventure: Graphical Adventures: Myst Series: Riven: Reviews and Previews,Games: Video Games: Adventure: Graphical Adventures: Obsidian: Reviews and Previews,Health: Specific Substances: Tobacco: History,News: Analysis and Opinion: Magazines and E-zines,News: Current Events: Business and Economy: Analysis and Opinion,News: Magazines and E-zines,Recreation: Food: Drink: Beer: Reviews,"Recreation: Outdoors: Hunting: Foxhunting: Art, Literature and Music: United States",Reference: Education: Educational Testing: Opposing Views,Regional: Africa: Rwanda: Society and Culture: History: Genocide,Regional: Africa: South Africa: Society and Culture: History: Nelson Mandela: News and Media,"Regional: Europe: United Kingdom: Society and Culture: History: Parliament: Prime Ministers: Callaghan, James","Regional: Europe: United Kingdom: Society and Culture: History: Parliament: Prime Ministers: Eden, Sir Anthony",Regional: Middle East: Iraq: Society and Culture: Politics: Politicians: Saddam Hussein,Regional: North America: Regions: US-Mexico Border: Society and Culture,"Regional: North America: United States: Government: Elections: President: 2008: Candidates: Obama, Barack: News and Media",Regional: North America: United States: Society and Culture: Politics: Issues: Federal Budget: News and Media,"Regional: North America: United States: Society and Culture: Politics: Parties: Republican: People: Palin, Sarah",Regional: North America: United States: Tennessee: Government: Federal: US House of Representatives: Jim Cooper D-5,"Regional: North America: United States: Vermont: Society and Culture: History: People: Douglas, Stephen A.","Regional: North America: United States: Washington, DC: News and Media",Regional: Oceania: Australia: New South Wales: Localities: M: Maroubra: Arts and Entertainment,Science: Agriculture: Crop Plants: Coffee,Science: Astronomy: Solar System: Dwarf Planets: Pluto and Charon: Planet Controversy,Science: Biology: Microbiology: Virology,Science: Earth Sciences: Atmospheric Sciences: Meteorology: Storm Chasing,Science: Social Sciences: Economics: Economic Systems,"Science: Social Sciences: Economics: People: Galbraith, John Kenneth"
2,imdb.com,IMDb,21,2016-02-08,Yes,"Alexa Rank: 49 (Global), 27 (US)",Kids and Teens: Entertainment: Animation: Movies,Regional: Europe: United Kingdom: Arts and Entertainment: Television: Programmes: Dramas: Sharpe,Arts: Performing Arts: Magic: Magicians: Siegfried and Roy: Movies,Arts: Television: Programs: Science Fiction and Fantasy: W: Wizards & Warriors: Cast and Crew,"Arts: Performing Arts: Magic: Magicians: Burton, Lance: Movies","Arts: Literature: World Literature: Scottish: Authors: Rankin, Ian",Arts: Television: Programs: Horror: Kindred - The Embraced: Cast and Crew,Arts: Television: Programs: Science Fiction and Fantasy: P: Poltergeist - The Legacy: Cast and Crew,Regional: Europe: United Kingdom: Arts and Entertainment: Television: Programmes: Dramas: Ultraviolet: Cast and Crew,Sports: Cricket: Movies,"Arts: Literature: Genres: Romance: Authors: C: Cartland, Barbara: Movies",Arts: Movies: Titles: 3: 3 Ninjas,Arts: Movies: Titles: F: First Knight: Reviews,"Arts: Movies: Titles: P: Princess Bride, The: Reviews","Arts: Performing Arts: Magic: Magicians: Jay, Ricky: Movies",Arts: Television: Programs: Horror: Forever Knight: Cast and Crew,Regional: Europe: United Kingdom: Arts and Entertainment: Television: Programmes: Comedy: Blackadder,Regional: Europe: United Kingdom: Arts and Entertainment: Television: Programmes: Dramas: Hornblower,Regional: Europe: United Kingdom: Arts and Entertainment: Television: Programmes: Science Fiction: Quatermass,Arts: Animation: Cartoons: Titles: A: Alvin and the Chipmunks,Arts: Animation: Cartoons: Titles: T: Tiny Toon Adventures: Resources,Arts: Animation: Cartoons: Titles: W: Wallace and Gromit,Arts: Movies: Titles: A: Amen. - 2002,Arts: Movies: Titles: C: Crossing Delancey,Arts: Movies: Titles: G: Gravesend,Arts: Movies: Titles: H: Home Alone Series: Home Alone,Arts: Movies: Titles: M: Mad Max Series,Arts: Movies: Titles: M: Moonstruck,"Arts: Performing Arts: Magic: Magicians: Historical Figures: Houdini, Harry: Movies","Arts: Television: Programs: Action and Adventure: Saint, The","Arts: Television: Programs: Dramas: Pretender, The",Arts: Television: Programs: Game Shows: To Tell the Truth,Arts: Television: Programs: Mini-Series: Anne of Green Gables,Arts: Television: Programs: Mini-Series: North and South,Arts: Television: Programs: Science Fiction and Fantasy: V: V,Regional: Europe: United Kingdom: Arts and Entertainment: Television: Programmes: Dramas: Bramwell,Regional: North America: Mexico: Arts and Entertainment: Cinema,"Kids and Teens: Entertainment: Animation: Movies: Lion King, The",Kids and Teens: Entertainment: Animation: Movies: Shrek,Kids and Teens: Entertainment: Animation: Movies: Toy Story,Arts: Animation: Anime: Titles: R: Revolutionary Girl Utena,Arts: Animation: Anime: Titles: S: Sailor Moon: Cast and Crew,"Arts: Animation: Movies: Titles: Iron Giant, The: Reviews",Arts: Animation: Voice Actors: Cast Lists: Cartoons: Gargoyles,"Arts: Literature: Authors: R: Rohmer, Sax",Arts: Movies: Cultures and Groups: Asian: Chinese,Arts: Movies: Cultures and Groups: Italian,"Arts: Movies: Filmmaking: Directing: Directors: C: Coen, Joel and Ethan","Arts: Movies: Filmmaking: Directing: Directors: W: Wachowski, Larry and Andy",Arts: Movies: Filmmaking: Short Films: Titles: 1,Arts: Movies: Genres: Action,Arts: Movies: Genres: Science Fiction and Fantasy,Arts: Movies: Titles: 1: 12 Angry Men - 1997,Arts: Movies: Titles: A: Angie,Arts: Movies: Titles: B: Beverly Hills Ninja,Arts: Movies: Titles: B: Boston Blackie Series,Arts: Movies: Titles: B: Bulldog Drummond Movies,Arts: Movies: Titles: C: Cabaret - 1972,Arts: Movies: Titles: D: Desk Set,Arts: Movies: Titles: D: Deuces Wild,Arts: Movies: Titles: E: El Cid,"Arts: Movies: Titles: E: Enemies, a Love Story",Arts: Movies: Titles: E: Evil Dead Series,Arts: Movies: Titles: F: Falcon Series,"Arts: Movies: Titles: G: Good Man in Africa, A",Arts: Movies: Titles: I: Inside,Arts: Movies: Titles: J: Joan the Maid,Arts: Movies: Titles: J: Just Another Girl on the I.R.T.,"Arts: Movies: Titles: K: Kid from Brooklyn, The",Arts: Movies: Titles: L: Les Misérables,Arts: Movies: Titles: L: Lolita - 1962,Arts: Movies: Titles: M: Malcolm X,Arts: Movies: Titles: M: Michael Shayne Series,Arts: Movies: Titles: M: Monsieur Hire,Arts: Movies: Titles: M: Mr. Wonderful,Arts: Movies: Titles: N: Nancy Drew Series,Arts: Movies: Titles: O: On the Town - 1949,Arts: Movies: Titles: P: Poltergeist Series: Poltergeist III,Arts: Movies: Titles: S: Saint Movies,Arts: Movies: Titles: S: Silent Running,Arts: Movies: Titles: S: Someone Else's America,Arts: Movies: Titles: S: Star Wars Movies: Episode I - The Phantom Menace,Arts: Movies: Titles: S: Star Wars Movies: Reviews,"Arts: Movies: Titles: T: Texas, Brooklyn and Heaven",Arts: Movies: Titles: T: Tulse Luper Suitcases Series,"Arts: Music: Bands and Artists: L: Lovett, Lyle","Arts: Music: Composition: Composers: P: Paganini, Niccolò",Arts: People: A: Abbott and Costello,"Arts: People: C: Champion, Gower and Marge","Arts: People: G: Grimes, Tammy","Arts: People: S: Sagal, Jean and Liz","Arts: People: W: Wilde, Lyn and Lee",Arts: Performing Arts: Magic: Magicians: Penn and Teller,"Arts: Performing Arts: Puppetry: Muppets: Movies: Muppet Movie, The",Arts: Performing Arts: Stunts: Players,Arts: Performing Arts: Theatre: Awards: American Theatre Wing's Tony Awards,Arts: Television: Programs: Action and Adventure: Airwolf,"Arts: Television: Programs: Action and Adventure: Return of the Saint, The",Arts: Television: Programs: Children's: BeetleBorgs,Arts: Television: Programs: Comedy: Sitcoms: What's Happening
3,nytimes.com,New York Times,26,2016-02-08,Yes,"Alexa Rank: 101 (Global), 22 (US)","Society: Issues: Warfare and Conflict: Specific Conflicts: War on Terrorism: News and Media: September 11, 2001: New York Times",Science: Social Sciences: Psychology: Evolutionary Psychology: Publications: Reviews,"Society: Issues: Warfare and Conflict: Specific Conflicts: War on Terrorism: News and Media: September 11, 2001: New York Times: Editorials",Computers: E-Books: News and Media,"Arts: Literature: Authors: I: Irving, John: Reviews","Arts: Literature: Authors: I: Irving, John","Arts: Literature: Authors: T: Thompson, Hunter S.: Reviews",Society: Issues: Environment: News and Media: Wildfire,"Regional: North America: United States: Minnesota: Society and Culture: History: Biography: Wellstone, Paul David",Society: Issues: Warfare and Conflict: Specific Conflicts: Iraq: Military Build-up,"Arts: Literature: Authors: Horror: K: King, Stephen: Works","Arts: Literature: Children's: Authors: R: Rowling, J. K.: Harry Potter Series: Articles and Interviews","Arts: Literature: World Literature: Canadian: Authors: Novelists: Richler, Mordecai: Works",Society: Activism: Media: Culture Jamming: etoy: Media Coverage,Society: Issues: Environment: Energy: News and Media,Society: Issues: Intellectual Property: Digital Rights Management: DVD Encryption: Articles,"Arts: Literature: Authors: B: Borges, Jorge Luis",News,"Science: Math: Mathematicians: W: Wolfram, Stephen",Society: Issues: Environment: Climate Change: News and Media,Society: Issues: Environment: News and Media: Politics,Society: Issues: Warfare and Conflict: Specific Conflicts: Iraq: International Policy: North America: United States,"Arts: Literature: Authors: B: Bass, Rick: Reviews","Arts: Literature: Authors: B: Bellow, Saul","Arts: Literature: Authors: B: Borges, Jorge Luis: Works","Arts: Literature: Authors: M: Murakami, Haruki","Arts: Literature: Genres: Espionage and War: Authors: le Carré, John",Computers: Internet: Searching: Search Engines: Google: News and Media,Health: Reproductive Health: Pregnancy and Birth: Complications: Obstetric Fistula,Reference: Education: Colleges and Universities: Admissions,Reference: Libraries: Library and Information Science: Intellectual Freedom: USA PATRIOT Act,Regional: North America: United States: Government: Elections: President: 2012: News and Media,Regional: North America: United States: Society and Culture: Politics: Issues: Health Care Reform: News and Media,Society: Issues: Business: Allegedly Unethical Firms: McWane,Society: Issues: Environment: News and Media,Society: Issues: Environment: News and Media: Land,Sports: Resources: News and Media,Arts: Animation: Anime: Titles: S: Spirited Away: Reviews,"Arts: Art History: Artists: C: Church, Frederic Edwin","Arts: Art History: Artists: R: Ruby, Sterling","Arts: Illustration: Caricature: Hirschfeld, Al","Arts: Literature: Authors: B: Borges, Jorge Luis: Reviews","Arts: Literature: Authors: B: Burgess, Anthony","Arts: Literature: Authors: E: Ellison, Ralph","Arts: Literature: Authors: H: Hassler, Jon","Arts: Literature: Authors: Horror: K: King, Stephen: Articles and Interviews","Arts: Literature: Authors: Horror: K: King, Stephen: Reviews","Arts: Literature: Authors: L: Lethem, Jonathan: Novels: Motherless Brooklyn","Arts: Literature: Authors: P: Paine, Tom","Arts: Literature: Authors: W: Weir, Alison: Reviews","Arts: Literature: World Literature: Canadian: Authors: Novelists: Richler, Mordecai","Arts: Literature: World Literature: Irish: Authors: Joyce, James",Arts: Movies: Titles: I: In Praise of Love,Arts: Movies: Titles: M: Mickey Blue Eyes,Arts: Movies: Titles: N: Nicholas Nickleby - 2002,"Arts: Music: Bands and Artists: D: Diddley, Bo","Arts: Music: Styles: B: Blues: Bands and Artists: K: King, B.B.",Computers: Companies: Yahoo Inc.: News and Media,"Computers: History: Pioneers: Jobs, Steve",Computers: Internet: Searching: Directories: Open Directory Project: News and Media: 2000,Computers: Security: Biometrics: Face Recognition: News and Media,Home: News and Media,News: Analysis and Opinion: Columnists: National Issues: United States,News: Analysis and Opinion: Columnists: World Issues,News: Newspapers: International,"Reference: Education: Colleges and Universities: North America: United States: Ohio: Kent State University: May 4, 1970 Shootings",Regional: Africa: South Africa: Society and Culture: History: Nelson Mandela: News and Media,Regional: Asia: Afghanistan: Society and Culture: Politics: Taliban Islamic Movement,Regional: Asia: Japan: Society and Culture: Issues,Regional: Asia: Japan: Society and Culture: Politics,Regional: Europe: United Kingdom: Society and Culture: Politics: Issues: Hunting Bills: News and Media: 2002: December,Regional: Europe: United Kingdom: Society and Culture: Politics: Issues: Hunting Bills: News and Media: 2002: September: Countryside March,Regional: North America: United States: Government: Elections: 2014,"Regional: North America: United States: Government: Elections: President: 2008: Candidates: Bloomberg, Michael","Regional: North America: United States: Government: Elections: President: 2008: Candidates: Romney, Mitt",Regional: North America: United States: Government: Elections: President: 2012: Debates: Republican Primary,Regional: North America: United States: Illinois: Localities: C: Chicago: Government: Mayor Rahm Emanuel,Regional: North America: United States: New York: Localities: N: New York City: Manhattan: Arts and Entertainment: Architecture: World Trade Center: Rebuilding,Regional: North America: United States: Society and Culture: Politics: Candidates and Campaigns: News and Media,Regional: North America: United States: Society and Culture: Politics: Candidates and Campaigns: US House,Regional: North America: United States: Society and Culture: Politics: Issues: Election Reform: Campaign Finance,Regional: North America: United States: Society and Culture: Politics: Issues: Gun Control: News and Media,Regional: North America: United States: Society and Culture: Politics: Issues: Homeland Security: USA PATRIOT Act,Regional: North America: United States: Society and Culture: Politics: Issues: Keystone Pipeline,Regional: North America: United States: Society and Culture: Politics: News and Media,"Regional: North America: United States: Society and Culture: Politics: Parties: Republican: People: Palin, Sarah",Regional: North America: United States: Society and Culture: Politics: Polls and Surveys,Regional: North America: United States: Society and Culture: Politics: Transparency,"Science: Social Sciences: Economics: People: Keynes, John Maynard",Science: Technology: News and Media,Science: Technology: Space: Missions: Manned: Russian: Mir Space Station,Society: Activism: Media: Culture Jamming: Spoof Websites: gwbush.com,Society: Crime: Sex Offenses: Child Pornography: Legal Information: Ashcroft v. Free Speech Coalition,Society: History: By Topic: Maritime: Ships: Ocean Liners: Titanic,"Society: History: Historians: Parker, Geoffrey",Society: Issues: Business: Allegedly Unethical Firms: Koch Industries,Society: Issues: Education: Standardized Testing,Society: Issues: Environment: Light Pollution: News and Media,Society: Issues: Environment: News and Media: Mining and Drilling,Society: Issues: Environment: News and Media: Water
4,theverge.com,The Verge,32,2016-02-08,Yes,"Alexa Rank: 525 (Global), 230 (US)",Home: Consumer Information: Computers and Internet: Hardware: Laptops,Home: Consumer Information: Electronics: Weblogs,,,,,,,,,,,,,,,,,,,,,,,,,,,,,,,,,,,,,,,,,,,,,,,,,,,,,,,,,,,,,,,,,,,,,,,,,,,,,,,,,,,,,,,,,,,,,,,,,,
5,nbc.com,NBC Universal,33,2016-02-08,Yes,"Alexa Rank: 1548 (Global), 426 (US)",Kids and Teens: Entertainment: Television: Reality Shows,Arts: Television: Networks: NBC,Arts: Television: Programs: Action and Adventure: Chuck,Arts: Television: Programs: Comedy: Sitcoms: 30 Rock,Arts: Television: Programs: Comedy: Sitcoms: Joey,Arts: Television: Programs: Comedy: Sitcoms: My Name Is Earl,Arts: Television: Programs: Comedy: Sketch Comedy: Saturday Night Live,"Arts: Television: Programs: Dramas: Black Donnellys, The",Arts: Television: Programs: Dramas: Crossing Jordan,Arts: Television: Programs: Dramas: Friday Night Lights,Arts: Television: Programs: Dramas: Heroes,Arts: Television: Programs: Dramas: Medical: ER,Arts: Television: Programs: Game Shows: Deal or No Deal,Arts: Television: Programs: Reality-Based: Fear Factor,Arts: Television: Programs: Soap Operas: Days of Our Lives,Business: Accounting: Firms: Accountants: Oceania: Australia: Queensland,Recreation: Autos: Magazines and E-zines: Weblogs,Regional: North America: United States: New York: Localities: N: New York City: News and Media: Television,Regional: North America: United States: New York: Localities: R: Rochester: News and Media: Television,World: Chinese Simplified: 商业: 化工: 精细,,,,,,,,,,,,,,,,,,,,,,,,,,,,,,,,,,,,,,,,,,,,,,,,,,,,,,,,,,,,,,,,,,,,,,,,,,,,,,,,
6,esquire.com,Esquire,58,2016-02-08,Yes,"Alexa Rank: 1696 (Global), 554 (US)","Arts: People: C: Clooney, George","Regional: North America: United States: Government: Elections: President: 2004: Candidates: Clark, Wesley: News and Media",Society: People: Men: Publications,World: Türkçe: Toplum: İnsanlar: Erkek: Basın ve Yayın,,,,,,,,,,,,,,,,,,,,,,,,,,,,,,,,,,,,,,,,,,,,,,,,,,,,,,,,,,,,,,,,,,,,,,,,,,,,,,,,,,,,,,,,,,,,,,,,
7,liquor.com,Liquor,59,2016-02-08,Yes,"Alexa Rank: 19805 (Global), 4787 (US)",Home: Cooking: Beverages: Cocktails: Collections and Indexes,Recreation: Food: Drink: Cocktails,,,,,,,,,,,,,,,,,,,,,,,,,,,,,,,,,,,,,,,,,,,,,,,,,,,,,,,,,,,,,,,,,,,,,,,,,,,,,,,,,,,,,,,,,,,,,,,,,,
