Site UID,Site URL,Site Human-Readable Name,Policy UID,Site Check Date,In 115 Set?,Comments,Sectoral Data,,,,,,,,,,,,,,,,,,,,,,,,,,,,,,,,,,,,,,,,,,,,,,,,,,,,,,,,,,,,,,,,,,,,,,,,,,,,,,,,,,,,,,,,,,,,,,,,,,,
39,loc.gov,Library of Congress,559,2016-02-08,Yes,"Alexa Rank: 4855 (Global), 1326 (US)",Regional: Europe: Russia: Society and Culture: History: Soviet Union: Library of Congress Archives,Regional: North America: United States: California: Localities: S: San Francisco: Society and Culture: History: Maps and Views,Regional: North America: United States: Government: Legislative Branch: Agencies that Support Congress: Library of Congress,Regional: North America: United States: Michigan: Localities: A: Ann Arbor: Arts and Entertainment: Architecture: Historic Buildings,Regional: North America: United States: Michigan: Localities: H: Harsens Island: Society and Culture: History,Regional: North America: United States: California: Localities: S: San Francisco: Maps and Views: Photos,Regional: North America: United States: California: Maps and Views,Society: History: By Region: North America: United States,Regional: North America: United States: California: Localities: L: Los Angeles: Maps and Views,Society: Ethnicity: Asian: Caucasian: Armenian: Armenian-American: Cultural Arts: Music,Society: History: By Region: North America: United States: West,Regional: North America: United States: Connecticut: Localities: N: Norwalk: Maps and Views,Regional: North America: United States: Government: Legislative Branch: Agencies that Support Congress: Library of Congress: Congressional Research Service: Legislative Proposals,Society: Ethnicity: African: African-American: History,Society: History: By Region: North America: United States: Women: Suffrage Movement,"Arts: Literature: World Literature: American: 19th Century: Washington, Booker T.: Works",Arts: Movies: History,Reference: Libraries: Library and Information Science: Technical Services: Cataloguing: Classification: Library of Congress,Reference: Libraries: Library and Information Science: Technical Services: Cataloguing: Metadata: Z39.50,Regional: Asia: Japan: Arts and Entertainment: Traditional,Regional: Europe: Russia: Society and Culture: History: Russian Empire,Regional: North America: United States: California: Localities: S: Sacramento: Maps and Views,Regional: North America: United States: California: Localities: S: San Francisco: Society and Culture: History: Cable and Street Cars,Regional: North America: United States: California: Localities: S: San Jose: Maps and Views,Regional: North America: United States: California: Localities: S: Santa Barbara: Maps and Views,Regional: North America: United States: California: Metro Areas: San Francisco Bay Area: Maps and Views: Photos,Regional: North America: United States: Connecticut: Localities: D: Danbury: Maps and Views,Regional: North America: United States: Connecticut: Localities: H: Hartford: Arts and Entertainment: Architecture: Historic: Mark Twain House,Regional: North America: United States: Connecticut: Localities: M: Middletown: Maps and Views,Regional: North America: United States: Michigan: Localities: I: Iron Mountain: Maps and Views,Regional: North America: United States: Minnesota: Localities: D: Duluth: Maps and Views,Society: History: By Region: North America: United States: Presidents,"Society: History: By Region: North America: United States: Presidents: Washington, George: Speeches and Writings",Society: History: By Topic: Social History: Oppression and Intolerance: Slavery: North America,Kids and Teens: School Time: Social Studies: History: By Region: North America: United States,"Arts: Literature: Authors: E: Ellison, Ralph","Arts: Literature: World Literature: American: 19th Century: Washington, Booker T.",Arts: Music: Musicology: Ethnomusicology: Archives,Arts: Photography: Reference: Collections,Reference: Archives: Regional: United States,Reference: Libraries: Library and Information Science: Digital Library Development,Reference: Libraries: Library and Information Science: Library History,Reference: Libraries: Library and Information Science: Technical Services: Cataloguing: Metadata: Encoded Archival Description,Reference: Libraries: Library and Information Science: Technical Services: Cataloguing: Metadata: MARC,Reference: Libraries: Subject Specific: Social Sciences: Area Studies,Reference: Libraries: Subject Specific: Social Sciences: Labor,Reference: Maps: Historical,Reference: Thesauri: By Subject,Regional: Africa: Angola: Government,Regional: Africa: Angola: Society and Culture: History,Regional: Africa: Guinea-Bissau: Government,Regional: Africa: Libya: Guides and Directories,Regional: Africa: Mozambique: Government,Regional: Africa: Sao Tome and Principe: Government,Regional: Asia: Laos: Guides and Directories,Regional: Asia: Macao: Society and Culture: History,Regional: Asia: Nepal: Guides and Directories,Regional: Caribbean: Dominican Republic: Guides and Directories,Regional: North America: United States: Alabama: Arts and Entertainment: Architecture: Historic Buildings,Regional: North America: United States: Arts and Entertainment: Architecture: Historic Buildings,Regional: North America: United States: California: Counties: San Diego: Maps and Views: Photos,Regional: North America: United States: California: Society and Culture: History,Regional: North America: United States: Connecticut: Localities: B: Bridgeport: Maps and Views,Regional: North America: United States: Connecticut: Localities: B: Bristol: Society and Culture: History: Maps and Views,Regional: North America: United States: Connecticut: Localities: M: Manchester: Maps and Views,Regional: North America: United States: Connecticut: Localities: N: Naugatuck,Regional: North America: United States: Connecticut: Localities: P: Plainville: Maps and Views,Regional: North America: United States: Connecticut: Localities: S: Stamford: Maps and Views,Regional: North America: United States: Connecticut: Localities: T: Torrington: Society and Culture: History,Regional: North America: United States: Connecticut: Localities: W: Waterbury: Maps and Views,Regional: North America: United States: Connecticut: Localities: W: Willimantic: Maps and Views,Regional: North America: United States: Florida: Localities: J: Jacksonville: Society and Culture,Regional: North America: United States: Florida: Localities: T: Tallahassee: Society and Culture: History,Regional: North America: United States: Florida: Society and Culture: History,Regional: North America: United States: Government: Elections,Regional: North America: United States: Government: Law: Constitution: Bill of Rights,Regional: North America: United States: Government: Legislative Branch,Regional: North America: United States: Government: Legislative Branch: House of Representatives: Speaker of the House: House Historian: Robert Vincent Remini,Regional: North America: United States: Illinois: Localities: C: Chicago: Society and Culture: History,Regional: North America: United States: Maps and Views,Regional: North America: United States: Michigan: Localities: L: Lake Linden: Society and Culture,Regional: North America: United States: Minnesota: Localities: M: Minneapolis: Maps and Views,Regional: North America: United States: Minnesota: Localities: R: Red Wing,Regional: North America: United States: Minnesota: Localities: S: Saint Paul: Maps and Views,Regional: North America: United States: Minnesota: Maps and Views,Regional: North America: United States: New Mexico: Society and Culture: History,"Regional: North America: United States: Society and Culture: Politics: Issues: Gun Control: Legislation: S.649 - Safe Communities, Safe Schools Act of 2013",Science: Social Sciences: Geography: Human Geography,Society: Genealogy: Resources: Libraries and Archives,Society: History: By Region: Caribbean: Puerto Rico,Society: History: By Region: North America: United States: Historical Documents,Society: History: By Region: North America: United States: Political Parties: Know-Nothings,"Society: History: By Region: North America: United States: Presidents: Buchanan, James","Society: History: By Region: North America: United States: Presidents: Buchanan, James: Speeches and Writings","Society: History: By Region: North America: United States: Presidents: Lincoln, Abraham: Speeches and Writings: Gettysburg Address",Society: History: By Region: North America: United States: Wars: Civil War,Society: History: By Time Period: Nineteenth Century: Wars and Conflicts: Mexican-American War,Society: History: By Time Period: Nineteenth Century: Wars and Conflicts: Spanish-American War,Society: History: By Time Period: Twentieth Century: Wars and Conflicts: World War I: Regional: United States,Society: History: By Time Period: Twentieth Century: Wars and Conflicts: World War II: By Country: United States: Relocation and Internment: WRA Relocation Camps
40,abita.com,Abita,571,2016-02-08,Yes,"Alexa Rank: 571900 (Global), 93409 (US)",Recreation: Food: Drink: Beer: Brewers: United States: Louisiana,Regional: Europe: United Kingdom: England: Somerset: Chew Magna,Regional: North America: United States: Louisiana: Localities: A: Abita Springs: Business and Economy,,,,,,,,,,,,,,,,,,,,,,,,,,,,,,,,,,,,,,,,,,,,,,,,,,,,,,,,,,,,,,,,,,,,,,,,,,,,,,,,,,,,,,,,,,,,,,,,,
41,coffeereview.com,Coffee Review,581,2016-02-08,Yes,"Alexa Rank: 143465 (Global), 39795 (US)",Health: Specific Substances: Coffee,Recreation: Food: Drink: Coffee,,,,,,,,,,,,,,,,,,,,,,,,,,,,,,,,,,,,,,,,,,,,,,,,,,,,,,,,,,,,,,,,,,,,,,,,,,,,,,,,,,,,,,,,,,,,,,,,,,
42,communitycoffee.com,Community Coffee,584,2016-02-08,Yes,"Alexa Rank: 274369 (Global), 50822 (US)",Regional: North America: United States: Louisiana: Localities: B: Baton Rouge: Business and Economy: Shopping,Shopping: Food: Beverages: Coffee and Tea: Coffee,,,,,,,,,,,,,,,,,,,,,,,,,,,,,,,,,,,,,,,,,,,,,,,,,,,,,,,,,,,,,,,,,,,,,,,,,,,,,,,,,,,,,,,,,,,,,,,,,,
43,cariboucoffee.com,Caribou Coffee,586,2016-02-08,Yes,"Alexa Rank: 96128 (Global), 22279 (US)",Business: Hospitality: Restaurant Chains: Coffee,Regional: North America: United States: Business and Economy: Restaurants and Bars,Shopping: Food: Beverages: Coffee and Tea: Coffee,,,,,,,,,,,,,,,,,,,,,,,,,,,,,,,,,,,,,,,,,,,,,,,,,,,,,,,,,,,,,,,,,,,,,,,,,,,,,,,,,,,,,,,,,,,,,,,,,
44,sites.google.com,Google Sites,591,2016-02-08,Yes,"Alexa Rank: 1 (Global), 1 (US)",Regional: North America: United States: Colorado: Localities: A: Arvada: Education: K-12,Regional: North America: United States: Colorado: Localities: L: Lakewood: Education: K-12: Elementary Schools,Regional: North America: United States: Colorado: Localities: L: Littleton: Education: K-12: Elementary Schools,Regional: North America: United States: Virginia: Localities: M: Midlothian: Education,Regional: North America: United States: Oregon: Localities: G: Grants Pass: Education,Society: Religion and Spirituality: Yoga: Paths: Karma: Sahaja Yoga: Sahaja Yoga Experiences,Regional: North America: United States: Colorado: Localities: P: Parker: Education: K-12,Regional: North America: United States: Colorado: Localities: W: Wheat Ridge: Education: K-12,Regional: North America: United States: Arkansas: Localities: B: Benton: Education: K-12,Regional: North America: United States: Oklahoma: Localities: N: Norman: Education: Elementary Schools,Regional: North America: United States: Virginia: Localities: S: Salem: Education,World: Japanese: アート: 音楽: ジャズ: バンドとアーティスト: 学生,Kids and Teens: People and Society: Organizations: Personal Development: Scouting: Boy Scouts of America: Troops: California,Recreation: Outdoors: Hunting: Guides and Outfitters: North America: United States: Texas,Regional: North America: United States: Colorado: Localities: G: Golden: Education,Regional: North America: United States: Iowa: Education: School Districts,Regional: North America: United States: Massachusetts: Localities: W: Watertown: Education,Regional: North America: United States: New Hampshire: Education: School Administrative Units,Regional: North America: United States: Virginia: Localities: C: Chesterfield: Education,Regional: North America: United States: Wyoming: Localities: G: Gillette: Education: K-12,Recreation: Collecting: Stamps: Organizations: Local Clubs,Recreation: Scouting: Organizations: Boy Scouts of America: Troops: California,Recreation: Scouting: Organizations: Boy Scouts of America: Troops: Missouri,Regional: North America: United States: Arkansas: Education: K-12: School Districts,Regional: North America: United States: California: Localities: A: Arroyo Grande: Education,Regional: North America: United States: Colorado: Localities: E: Evergreen: Education: K-12,Regional: North America: United States: Colorado: Localities: L: Littleton: Education: K-12,Regional: North America: United States: Colorado: Localities: W: Westminster: Education: K-12: Elementary,Regional: North America: United States: Connecticut: Localities: D: Danbury: Education: K-12,Regional: North America: United States: Connecticut: Localities: S: Stonington: Education: K-12,Regional: North America: United States: Idaho: Education: K-12: School Districts,Regional: North America: United States: Idaho: Localities: C: Caldwell: Education,Regional: North America: United States: Iowa: Localities: M: Mason City: Education: K-12: Public: Elementary,Regional: North America: United States: Maine: Localities: Y: York: Education,Regional: North America: United States: Oklahoma: Localities: N: Norman: Education: Secondary Schools,Regional: North America: United States: Virginia: Localities: K: King George: Education,Society: Religion and Spirituality: Christianity: Denominations: Catholicism: Education: K through 12: North America: Canada: Ontario,Society: Religion and Spirituality: Christianity: Denominations: Methodist: United Methodist: Local Churches: United States: California,Sports: Badminton: Clubs: United Kingdom: England,World: Français: Régional: Amérique: Canada: Québec: Municipalités: Q: Ville de Québec: Commerce et économie: Ressources: Conférences,Arts: Visual Arts: Painting: Painters: Contemporary: G,Recreation: Aviation: Aircraft: Soaring: Clubs: North America: United States,Recreation: Scouting: Organizations: Scouts Canada: Scouting Groups: Ontario,Recreation: Scouting: Organizations: United Kingdom Scout Association: Scout Groups: Hereford and Worcester,Regional: North America: United States: Colorado: Localities: H: Highlands Ranch: Education: K-12,Regional: North America: United States: Colorado: Localities: L: Lakewood: Education: K-12,Regional: North America: United States: Maine: Localities: B: Biddeford: Education,Regional: North America: United States: Maine: Localities: C: Corinth: Education,Regional: North America: United States: Maine: Localities: S: Scarborough: Education,Regional: North America: United States: Maine: Localities: W: Winthrop: Education,Regional: North America: United States: Massachusetts: Localities: M: Maynard: Education,Regional: North America: United States: Massachusetts: Localities: W: West Bridgewater: Education,Regional: North America: United States: Michigan: Education: School Districts: Public,Regional: North America: United States: North Dakota: Education: K-12: School Districts,Regional: North America: United States: Oregon: Localities: C: Cave Junction: Education,Regional: North America: United States: Oregon: Localities: S: Salem: Education: K-12,Regional: North America: United States: Pennsylvania: Education: K-12: School Districts,Regional: North America: United States: Tennessee: Localities: C: Cookeville: Education: K-12,Regional: North America: United States: Texas: Localities: G: Goliad: Education,Science: Environment: Products and Services: Consultants: Regional: North America: United States,Society: People: Personal Homepages: S,Society: Religion and Spirituality: Christianity: Denominations: Catholicism: Education: K through 12: Oceania: Australia: New South Wales,Society: Religion and Spirituality: Christianity: Denominations: Catholicism: Parishes: Europe: United Kingdom: England,Society: Religion and Spirituality: Christianity: Denominations: Methodist: United Methodist: Local Churches: United States: Michigan,Society: Religion and Spirituality: Christianity: Denominations: Methodist: United Methodist: Local Churches: United States: New York,Society: Religion and Spirituality: Christianity: Denominations: Presbyterian: Presbyterian Church USA: Churches: United States: Pennsylvania,Sports: Korfball: Clubs,Sports: Running: Clubs: Europe: United Kingdom: England,Sports: Water Sports: Swimming and Diving: Regional: Europe: United Kingdom: England,World: Català: Arts i cultura: Música: Estils: Tradicional: Sardana: Particel·les,World: Català: Regional: Catalunya: Barcelona: Vallès Occidental: Ensenyament,World: Français: Régional: Europe: France: Sports et loisirs: Sports: Arts martiaux: Judo et Ju-Jitsu,World: Hebrew: בריאות: ארגונים ואגודות,World: Nederlands: Maatschappij: Religie en Spiritualiteit: Christendom: Denominaties: Protestants: Vrijzinnig: Plaatselijke Gemeenten,World: Suomi: Vapaa-aika: Lemmikit: Kissat: Kissarodut: Siperiankissa,Kids and Teens: International: Arabic,Kids and Teens: International: Español: Juegos: Acertijos y laberintos: Rubik,Kids and Teens: People and Society: Organizations: Personal Development: Scouting: Boy Scouts of America: Troops: Minnesota,Arts: Literature: Poetry: Organizations,Arts: Literature: World Literature: British: Old English: Individual Prose Works: Aelfric: Biblical Translations,Arts: Literature: World Literature: British: Old English: Individual Prose Works: Alfredian Prose,Arts: Music: Instruments: Winds: Woodwinds: Recorder: Regional,Arts: Music: Styles: C: Choral: Performing Groups: Mixed Choirs: Europe: United Kingdom: England: London,Arts: Performing Arts: Dance: Folk: English Country Dancing,Arts: Performing Arts: Theatre: Community Theatre: United Kingdom: England,Arts: Visual Arts: Painting: Painters: Surrealism,Business: Management: Management Science: Management Information Systems: Call For Papers,Computers: Internet: Searching: Search Engines: Google,Games: Video Games: Action: Space Combat: Massive Multiplayer Online: EVE Online: Corporations and Alliances,Home: Family: Multiple Births: Personal Pages: Quadruplets,Recreation: Climbing: Organizations: Europe: United Kingdom: England,Recreation: Collecting: Stamps: Topical Collecting: Nature,Recreation: Living History: Society for Creative Anachronism: Kingdoms: Trimaris,Recreation: Radio: Amateur: Personal Pages: United Kingdom,Recreation: Scouting: Organizations: Boy Scouts of America: Troops: Minnesota,Recreation: Scouting: Organizations: Boy Scouts of America: Troops: Oklahoma,Recreation: Scouting: Organizations: Boy Scouts of America: Troops: Wisconsin,Recreation: Scouting: Organizations: Scouts Australia: Scouting Groups: Queensland,Reference: Education: Colleges and Universities: Europe: United Kingdom: England: Lancaster University: Organizations,Reference: Education: Colleges and Universities: North America: United States: Arizona: Arizona State University: Organizations
45,dairyqueen.com,Dairy Queen,627,2016-02-08,Yes,"Alexa Rank: 44927 (Global), 8062 (US)",Business: Hospitality: Restaurant Chains: Ice Cream and Yogurt,Regional: North America: United States: Minnesota: Localities: E: Edina: Business and Economy,Regional: North America: United States: Ohio: Localities: G: Garrettsville: Business and Economy,,,,,,,,,,,,,,,,,,,,,,,,,,,,,,,,,,,,,,,,,,,,,,,,,,,,,,,,,,,,,,,,,,,,,,,,,,,,,,,,,,,,,,,,,,,,,,,,,
46,playstation.com,Playstation,635,2016-02-08,Yes,"Alexa Rank: 400 (Global), 137 (JP)",Games: Video Games: Console Platforms: Sony,Kids and Teens: Games: Computer and Video: Handhelds: Playstation Vita,Kids and Teens: International: Español: Juegos: Videojuegos: Conducción y carreras: LittleBigPlanet Karting,Kids and Teens: International: Español: Juegos: Videojuegos: LittleBigPlanet: LittleBigPlanet,Games: Video Games: Console Platforms: Sony: PlayStation Portable,Games: Video Games: Driving and Racing: Simulations: Gran Turismo Series: Gran Turismo 5 Prologue,World: Español: Juegos: Videojuegos: Por género: Deportes: Automovilismo: LittleBigPlanet Karting,World: Español: Juegos: Videojuegos: Por género: LittleBigPlanet: LittleBigPlanet,Kids and Teens: Games: Computer and Video: Consoles,Kids and Teens: Games: Computer and Video: Consoles: PlayStation,Kids and Teens: Games: Computer and Video: Consoles: PlayStation 2,Kids and Teens: Games: Computer and Video: Consoles: PlayStation 3,Kids and Teens: Games: Computer and Video: Consoles: PlayStation 4,Kids and Teens: Games: Computer and Video: Game Creators: Sony,Kids and Teens: Games: Computer and Video: PaRappa the Rapper Series: Um Jammer Lammy,Kids and Teens: International: Español: Juegos: Videojuegos: Acción: Lego Batman - Series: Lego Batman 2 - DC Super Heroes,Kids and Teens: International: Español: Juegos: Videojuegos: Acción: Starhawk,Kids and Teens: International: Español: Juegos: Videojuegos: Consolas: PS4,Kids and Teens: International: Español: Juegos: Videojuegos: Consolas: Sony: PlayStation,Kids and Teens: International: Español: Juegos: Videojuegos: Fat Princess,Kids and Teens: International: Español: Juegos: Videojuegos: LittleBigPlanet: LittleBigPlanet PS Vita,Kids and Teens: International: Español: Juegos: Videojuegos: LittleBigPlanet: Sackboy's Prehistoric Moves,Kids and Teens: International: Español: Juegos: Videojuegos: Lógica e ingenio: Flow,Kids and Teens: International: Español: Juegos: Videojuegos: Lógica e ingenio: Flower,Kids and Teens: International: Français: Jeux: Jeux vidéo,Kids and Teens: International: Japanese: ゲーム: テレビゲーム: メーカー: ソニー,Kids and Teens: International: Japanese: ゲーム: テレビゲーム: 携帯型ゲーム機: プレイステーション・ポータブル,Kids and Teens: International: Japanese: ゲーム: テレビゲーム: 機種: プレイステーション,Kids and Teens: International: Russian: Игры: Компьютерные и видеоигры,Kids and Teens: International: Türkçe: Oyunlar: Bilgisayar ve Video Oyunları: Konsollar: PlayStation 3,Games: Video Games: Action-Adventure: Survival Horror: Resident Evil Series: Director's Cut: Reviews and Previews,Games: Video Games: Action: Space Combat: Star Trek Games: Invasion: Cheats and Hints,Games: Video Games: Console Platforms: Sony: PlayStation,Games: Video Games: Developers and Publishers: W,Games: Video Games: Driving and Racing: Simulations: Gran Turismo Series: Gran Turismo 4,World: Chinese Simplified: 游戏: 电子游戏: 游戏机平台: 索尼,World: Deutsch: Online-Shops: Computer: Spiele: Konsolen,World: Deutsch: Spiele: Computerspiele: Spielkonsolen: Sony,World: Deutsch: Spiele: Computerspiele: Spielkonsolen: Sony: PlayStation 3,World: Español: Juegos: Videojuegos: Consolas: Sony,World: Español: Juegos: Videojuegos: Consolas: Sony: PS4,World: Español: Juegos: Videojuegos: Noticias y críticas,World: Español: Juegos: Videojuegos: Por género: Acción: Lego Batman - Series: Lego Batman 2 - DC Super Heroes,World: Español: Juegos: Videojuegos: Por género: Estrategia: Starhawk,World: Español: Juegos: Videojuegos: Por género: LittleBigPlanet: LittleBigPlanet PS Vita,World: Español: Juegos: Videojuegos: Por género: LittleBigPlanet: Sackboy's Prehistoric Moves,World: Français: Jeux: Jeux vidéo: Consoles: Sony,World: Français: Jeux: Jeux vidéo: Consoles: Sony: Playstation 2,World: Greek: Παιχνίδια,World: Italiano: Giochi: Video Giochi: Console: Sony,World: Italiano: Giochi: Video Giochi: Sparatutto: Battlefield: Battlefield - Modern Combat,World: Italiano: Giochi: Video Giochi: Sparatutto: Mace Griffin - Bounty Hunter,World: Japanese: オンラインショップ: ゲーム・おもちゃ: ゲーム: ビデオゲーム,World: Japanese: ゲーム: ビデオゲーム: スポーツ: ゴルフ,World: Japanese: ゲーム: ビデオゲーム: 家庭用ゲーム機: ソニー,World: Nederlands: Spellen: Computerspellen: Spelconsoles: Sony,World: Polski: Gry: Komputerowe: Konsole,World: Russian: Игры: Компьютерные игры: Игровые приставки: Sony,World: Suomi: Pelit: Videopelit,World: Türkçe: Oyunlar: Video Oyunları: Konsol Platformları,,,,,,,,,,,,,,,,,,,,,,,,,,,,,,,,,,,,,,,,
47,gamestop.com,GameStop,640,2016-02-08,Yes,"Alexa Rank: 1087 (Global), 394 (US)",Shopping: Toys and Games: Games: Video Games,,,,,,,,,,,,,,,,,,,,,,,,,,,,,,,,,,,,,,,,,,,,,,,,,,,,,,,,,,,,,,,,,,,,,,,,,,,,,,,,,,,,,,,,,,,,,,,,,,,
48,gamerankings.com,GameRankings,641,2016-02-08,Yes,"Alexa Rank: 34096 (Global), 23691 (US)",Kids and Teens: Games: Computer and Video: Sonic the Hedgehog Series: Sonic Battle: Reviews and Previews,Games: Video Games: News and Reviews: G,Games: Video Games: Platform: Sonic the Hedgehog Games: Sonic Battle: Reviews and Previews,Games: Video Games: Roleplaying: Massive Multiplayer Online: Guild Wars: Reviews and Previews,Games: Video Games: Simulation: God Games: Traffic Giant: Reviews and Previews,,,,,,,,,,,,,,,,,,,,,,,,,,,,,,,,,,,,,,,,,,,,,,,,,,,,,,,,,,,,,,,,,,,,,,,,,,,,,,,,,,,,,,,,,,,,,,,
49,thefreedictionary.com,The Free Dictionary,642,2016-02-08,Yes,"Alexa Rank: 488 (Global), 447 (US)",Health: Conditions and Diseases: Infectious Diseases: Bacterial: Rat Bite Fever,Reference: Dictionaries,Reference: Dictionaries: World Languages: E: English: Slang,Society: Death: Suicide: Law,"Society: Philosophy: Philosophers: H: Hutchins, Robert Maynard",World: Français: Références: Dictionnaires: Langues: Multilingues,,,,,,,,,,,,,,,,,,,,,,,,,,,,,,,,,,,,,,,,,,,,,,,,,,,,,,,,,,,,,,,,,,,,,,,,,,,,,,,,,,,,,,,,,,,,,,
