Site UID,Site URL,Site Human-Readable Name,Policy UID,Site Check Date,In 115 Set?,Comments,Sectoral Data,,,,,,,,,,,,,,,,,,,,,,,,,,,,,,,,,,,,,,,,,,,,,,,,,,,,,,,,,,,,,,,,,,,,,,,,,,,,,,,,,,,,,,,,,,,,,,,,,,,
15,style.com,Vogue,144,2016-02-08,Yes,"Alexa Rank: 125832 (Global), 22617 (ID)",Arts: Design: Fashion: Magazines and E-zines: Women,World: Japanese: ゲーム: ビデオゲーム: ロールプレイング: MMORPG,World: Russian: Страны и регионы: Европа: Украина: Области: Киевская: Киев: Бизнес и экономика: Красота и косметические услуги,Arts: Crafts: Jewelry: Beads,Business: Consumer Goods and Services: Clothing: News and Media: Publications,Business: Consumer Goods and Services: Clothing: Women's: Formal Wear,Business: Food and Related Products: Consulting: Food Stylists,Business: Textiles and Nonwovens: Textiles: Resources: Portals,Computers: Data Formats: Style Sheets: CSS: Browser Compatibility,"Computers: Data Formats: Style Sheets: CSS: FAQs, Help, and Tutorials","Computers: Data Formats: Style Sheets: CSS: FAQs, Help, and Tutorials: Tutorials",Computers: Data Formats: Style Sheets: CSS: Tools: Browser Testing,Health: Beauty: Hair: Advice,Regional: Asia: India: Delhi: Health,Regional: Europe: Austria: Provinces: Vienna: Travel and Tourism: Lodging: Vacation Rentals,Regional: Europe: Portugal: Districts: Faro: Vale do Lobo,Regional: Europe: Spain: Autonomous Communities: Andalucia: Malaga: Alhaurin el Grande: Business and Economy: Real Estate,Regional: Europe: United Kingdom: Society and Culture: Women: Magazines,Regional: North America: United States: Hawaii: Maui: Localities: Lahaina: Business and Economy: Real Estate,Shopping: Ethnic and Regional: Latin American,Shopping: Health: Beauty: Hair Care: Accessories,Shopping: Health: Disabilities: Assistive Technology: Daily Living: Clothing,Shopping: Health: Disabilities: Assistive Technology: Mobility and Transportation: Canes and Walking Sticks,Shopping: Vehicles: Motorcycles,World: Arabic: ترفيه: العاب: ألعاب فلاش: العاب بنات,World: Chinese Simplified: 艺术: 摄影: 博客,World: Dansk: Netbutikker: Beklædning,World: Deutsch: Kultur: Musik: Genres: Country: Musiker,World: Deutsch: Online-Shops: Bekleidung: Damen,World: Deutsch: Online-Shops: Schönheit: Haare: Pflege,World: Deutsch: Regional: Europa: Deutschland: Hessen: Landkreise: Wetteraukreis: Städte und Gemeinden: Florstadt,World: Deutsch: Regional: Europa: Österreich: Wien: Wirtschaft: Dienstleistungen: Tattoo- und Piercing-Studios,World: Français: Arts: Musique: Genres: Jazz,World: Italiano: Acquisti Online: Articoli da Regalo,World: Japanese: アート: ガイドとディレクトリ,World: Japanese: アート: クラフト: 刺繍,World: Japanese: アート: パフォーミングアート: 俳優・タレント: た行,World: Japanese: アート: ビジュアルアート: コンピュータ・グラフィックス: ギャラリー,World: Japanese: アート: 写真: 写真家: な行,World: Japanese: オンラインショップ: アクセサリー・宝飾品: 携帯ストラップ,World: Japanese: オンラインショップ: オフィス・文房具: 文房具,World: Japanese: オンラインショップ: ファッション: カジュアル: 女性,World: Japanese: オンラインショップ: ファッション: ユニフォーム・作業服: 作業服,World: Japanese: オンラインショップ: ペット: は虫類・両生類,World: Japanese: オンラインショップ: 家庭・園芸: 生活雑貨,World: Japanese: オンラインショップ: 食品: 菓子・パン: パン,World: Japanese: ゲーム: ビデオゲーム: ロールプレイング: MMORPG: パーフェクトワールド,World: Japanese: ゲーム: ビデオゲーム: 家庭用ゲーム機: 任天堂,World: Japanese: スポーツ: モータースポーツ: 自動車: チームとドライバー,World: Japanese: スポーツ: 格闘技: 総合格闘技: ジム・道場,World: Japanese: ビジネス: 企業向けサービス: 法律・手続: 地域別: 東京,World: Japanese: ビジネス: 製品・サービス（一般消費者向け）: 健康・美容: 頭髪・理美容: サロン,World: Japanese: ビジネス: 製品・サービス（一般消費者向け）: 服飾・アパレル: 男性,World: Japanese: ビジネス: 雇用: 人材斡旋: 派遣・スタッフ,World: Japanese: レクリエーション: 旅行: 旅行記,World: Japanese: 健康: 代替療法: アロマテラピー,World: Japanese: 地域: アジア: 中華人民共和国: 旅行・観光,World: Japanese: 地域: アジア: 日本: 兵庫: 市町村: 西宮市: 社会・文化,World: Japanese: 地域: アジア: 日本: 大阪: 市町村: 大阪市: 社会・文化,World: Japanese: 地域: アジア: 日本: 新潟: 市町村: 上越市: ビジネス・経済,World: Japanese: 地域: アジア: 日本: 神奈川: 市町村: 横浜市: ビジネス・経済: 建設・保守,World: Japanese: 地域: アジア: 日本: 福岡: 市町村: 福岡市: ビジネス・経済: 飲食店,World: Japanese: 地域: アジア: 日本: 長野: アート・娯楽,World: Japanese: 地域: アジア: 日本: 長野: 市町村: 御代田町: ビジネス・経済: 飲食店,World: Japanese: 社会: 政治・行政: 国会: 議員経験者,World: Nederlands: Maatschappij: Relaties: Huwelijk: Bruidsmode: Merken en Designers,World: Russian: Бизнес: Строительство и эксплуатация: Проектирование и дизайн: Дизайн интерьера,World: Russian: Искусство: Изобразительное искусство: Блоги,World: Russian: Страны и регионы: Европа: Молдова: Города: Кишинев: Бизнес и экономика: Торговля,World: Russian: Страны и регионы: Европа: Украина: Области: Винницкая: Винница: Бизнес и экономика,World: Russian: Страны и регионы: Европа: Украина: Области: Днепропетровская: Днепропетровск: Бизнес и экономика: Реклама и маркетинг,World: Russian: Страны и регионы: Европа: Украина: Области: Киевская: Киев: Бизнес и экономика: Торговля: Одежда и обувь: Детская,World: Russian: Страны и регионы: Европа: Украина: Области: Харьковская: Харьков: Бизнес и экономика: Дом и сад: Дизайн интерьера,World: Ukrainian: Країни та реґіони: Європа: Україна: Області: Львівська: Львів: Бізнес та економіка: Комп'ютери та Інтернет,,,,,,,,,,,,,,,,,,,,,,,,,,
16,adweek.com,Adweek,164,2016-02-08,Yes,"Alexa Rank: 2893 (Global), 1415 (US)",Business: Marketing and Advertising: News and Media,News: Media: Industry News,News: Media Industry: Industry News,,,,,,,,,,,,,,,,,,,,,,,,,,,,,,,,,,,,,,,,,,,,,,,,,,,,,,,,,,,,,,,,,,,,,,,,,,,,,,,,,,,,,,,,,,,,,,,,,
17,mlb.mlb.com,Major League Baseball,175,2016-02-08,Yes,"Alexa Rank: 1026 (Global), 235 (US)",World: Español: Deportes: Béisbol: Equipos,Arts: Television: Networks: Cable: Sports,Regional: North America: United States: Connecticut: Society and Culture: Famous Nutmeggers: Sports: Daniel Lucius Adams,Regional: North America: United States: Texas: Localities: A: Arlington: Recreation and Sports,Shopping: Entertainment: Tickets: Sports: Baseball,Sports: Baseball: International,Sports: Baseball: Major League,Sports: Baseball: Major League: News and Media,Sports: Baseball: Major League: Scores and Schedules,Sports: Baseball: Major League: Statistics,"Sports: Baseball: People: Management: Giamatti, Angelo Bartlett","Sports: Baseball: People: Players: B: Banks, Ernie",Sports: Events: Olympics: Baseball,Sports: Fantasy: Baseball,World: Español: Deportes: Béisbol,World: Español: Regional: América: Estados Unidos: Deportes y tiempo libre: Deportes: Béisbol,World: Español: Regional: América: Estados Unidos: Estados: California: Condados: San Diego,,,,,,,,,,,,,,,,,,,,,,,,,,,,,,,,,,,,,,,,,,,,,,,,,,,,,,,,,,,,,,,,,,,,,,,,,,,,,,,,,,,
18,abcnews.go.com,ABC News,186,2016-02-08,Yes,"Alexa Rank: 553 (Global), 159 (US)",Arts: Television: Networks: ABC,Arts: Television: News: Programs: Interview and Debate,Arts: Television: News: Programs: News Magazines,"News: Media: Journalism: Journalists: S: Stossel, John","Regional: North America: United States: Government: Elections: President: 2004: Candidates: Kerry, John: News and Media",Society: Issues: Violence and Abuse: Elder: Nursing Home,Arts: Entertainment: News and Media,Arts: Movies: Titles: L: Lord of the Rings Series: Articles and Interviews,Arts: Movies: Titles: V: V for Vendetta: Reviews,"Arts: People: C: Clark, Dick","Arts: People: L: Lewis, Jeff",Arts: Television: News,Arts: Television: Programs: Children's: Sesame Street: Characters: Cookie Monster,Arts: Television: Programs: Children's: Sesame Street: Characters: Ernie and Bert,Arts: Television: Programs: Dramas: Big Love,Business: News and Media,Computers: Internet: E-mail: Spam: News and Media: 2001,Computers: Internet: E-mail: Spam: News and Media: 2002,Computers: Internet: History: The Trojan Room Coffee Machine,Health: Addictions,Health: Alternative: Biofeedback,Health: Conditions and Diseases: Endocrine Disorders: Thyroid: Co-morbid Conditions,Health: Conditions and Diseases: Infectious Diseases: Viral: Influenza: A-H1N1: News and Media,Health: Conditions and Diseases: Nutrition and Metabolism Disorders: Inherited: Trimethylaminuria,Health: Mental Health: Disorders: Neurodevelopmental: Autism Spectrum: News and Media,Health: News and Media,Home: Personal Finance: Philanthropy,News,News: Alternative: Odd News,News: Breaking News,News: Chats and Forums,News: Internet Broadcasts,Recreation: Drugs: Psychedelics: Salvia divinorum,Reference: Education: Educators: Academic Dishonesty,Reference: Libraries: Library and Information Science: Intellectual Freedom: USA PATRIOT Act,Regional: Africa: South Africa: Society and Culture: History: Nelson Mandela: News and Media,"Regional: Asia: Afghanistan: Society and Culture: Politics: Politicians: Karzai, Hamid",Regional: Europe: Ukraine: Autonomous Republic of Crimea: News and Media,Regional: Europe: Vatican City: News and Media,Regional: Middle East: Palestinian Territory: Society and Culture: Politics: Politicians: Mahmoud Abbas,Regional: Middle East: Palestinian Territory: Society and Culture: Politics: Politicians: Yasser Arafat,Regional: North America: United States: Florida: Society and Culture: Youth: Juvenile Justice: White House Boys,Regional: North America: United States: Georgia: Localities: A: Alapaha,Regional: North America: United States: Government: Agencies: Independent: National Railroad Passenger Corporation - Amtrak,"Regional: North America: United States: Government: Elections: President: 2004: Candidates: Clark, Wesley: News and Media","Regional: North America: United States: Government: Elections: President: 2004: Candidates: Moseley Braun, Carol: News and Media",Regional: North America: United States: Government: Elections: President: 2004: News and Media,Regional: North America: United States: Government: Elections: President: 2004: News and Media: Weblogs,Regional: North America: United States: Government: Elections: President: 2012: News and Media,Regional: North America: United States: Government: Executive Branch: President: POTUS Barack Obama: News and Media,Regional: North America: United States: Government: Legislative Branch: House of Representatives: Office of the Clerk: House Page Program,Regional: North America: United States: Society and Culture: Politics: Candidates and Campaigns: News and Media,"Regional: North America: United States: Society and Culture: Politics: Candidates and Campaigns: President: Candidates: Romney, Mitt",Regional: North America: United States: Society and Culture: Politics: Issues: Gay Marriage: News and Media,Regional: North America: United States: Society and Culture: Politics: Issues: Health Care Reform: News and Media,Regional: North America: United States: Society and Culture: Politics: Issues: Immigration: News and Media,Regional: North America: United States: Society and Culture: Politics: Issues: Minimum Wage: News and Media,Regional: North America: United States: Society and Culture: Politics: Issues: Money in Politics,Regional: North America: United States: Society and Culture: Politics: News and Media,"Regional: North America: United States: Society and Culture: Politics: Parties: Republican: People: Palin, Sarah",Science: Biology: Cryobiology: Cryonics,Science: Earth Sciences: Atmospheric Sciences: Meteorology: Weather Phenomena: Hurricanes: Past Hurricanes: Hurricane Katrina: News and Media,Science: News and Media,"Science: Social Sciences: Anthropology: Anthropologists: Biological Anthropologists: Koff, Clea","Science: Social Sciences: Gay, Lesbian, and Bisexual Studies: Gaydar","Society: History: By Region: North America: United States: Presidents: Clinton, William Jefferson",Society: Issues: Animal Welfare: Animal Experiments - Vivisection: Companies Involved: Huntingdon Life Sciences: News and Media: 2001,Society: Issues: Animal Welfare: Animal Experiments - Vivisection: Companies Involved: Huntingdon Life Sciences: News and Media: 2003,Society: Issues: Animal Welfare: Animal Rights: Opposing Views,Society: Issues: Animal Welfare: Specific Animals: Whales: Pro-Whaling,Society: Issues: Health: Tobacco: Advocacy: Pro-Tobacco: Critiques: Teen Smoking,Society: Issues: Health: Tobacco: Advocacy: Pro-Tobacco: Regulation: Lobbying: Critiques,"Society: Issues: Terrorism: Incidents: London Bombings, 2005",Society: Issues: Terrorism: Terrorist Organizations: Al-Qaida: Ayman al-Zawahiri,Society: Military: Aviation: Aircraft: Gunships: AC-130,Society: Religion and Spirituality: Opposing Views: Christianity: Catholicism: Opus Dei,Society: Religion and Spirituality: Scientology: Church of Scientology: News and Media,"Sports: Skating: Ice Skating: Skaters: Cohen, Sasha",Sports: Soccer: Competitions: World Cup,Sports: Soccer: Competitions: World Cup: 2014: News and Media,,,,,,,,,,,,,,,,,,,,
19,washingtonpost.com,Washington Post,200,2016-02-08,Yes,"Alexa Rank: 202 (Global), 45 (US)","Society: Issues: Warfare and Conflict: Specific Conflicts: War on Terrorism: News and Media: September 11, 2001: Washington Post","Society: History: By Region: North America: United States: Presidents: Bush, George Walker: Opposing Views: News and Media",News: Analysis and Opinion: Columnists: World Issues,Regional: Asia: Pakistan: Society and Culture: History: Personalities: Benazir Bhutto,"Regional: North America: United States: Society and Culture: Politics: Candidates and Campaigns: President: Candidates: Paul, Ron",Regional: North America: United States: Society and Culture: Politics: Issues: Gun Control: News and Media,"Regional: North America: United States: Washington, DC: Education",Science: Social Sciences: Psychology: Evolutionary Psychology: Publications: Reviews,"Sports: Baseball: People: Players: R: Ripken, Cal, Jr.: Articles and Interviews","Arts: Movies: Titles: A: Addams Family Movies: Addams Family, The","Arts: Movies: Titles: A: Adventures of Priscilla, Queen of the Desert, The: Reviews",Arts: Movies: Titles: A: All the President's Men,Arts: Movies: Titles: B: Battlefield Earth: Reviews,Arts: Movies: Titles: B: Blade Runner: Reviews,Arts: Movies: Titles: B: Brighton Beach Memoirs,Arts: Movies: Titles: B: Broadcast News,Arts: Movies: Titles: C: Chaplin,Arts: Movies: Titles: C: Cinema Paradiso,Arts: Movies: Titles: C: Cookie,Arts: Movies: Titles: D: Dead Poets Society: Reviews,"Arts: Movies: Titles: D: Doors, The","Arts: Movies: Titles: E: Enemies, a Love Story",Arts: Movies: Titles: F: First Knight: Reviews,"Arts: Movies: Titles: G: Good Man in Africa, A","Arts: Movies: Titles: G: Goodbye, Children","Arts: Movies: Titles: H: Hunt for Red October, The: Reviews",Arts: Movies: Titles: K: K2,"Arts: Movies: Titles: M: Matrix Series: Matrix, The: Reviews","Arts: Movies: Titles: P: Princess Bride, The: Reviews",Arts: Movies: Titles: R: Radio Days,Arts: Movies: Titles: R: Roger & Me,Arts: Movies: Titles: V: Vampire in Brooklyn,Arts: Movies: Titles: W: Willow: Reviews,Recreation: Pets: Dogs: Breeds: Working Group: Portuguese Water Dog: President Obama's First Dog,Recreation: Roads and Highways: North America: United States: Maryland,Regional: Africa: South Africa: Society and Culture: History: Nelson Mandela: News and Media,Regional: North America: United States: Government: Elections: 2006,"Regional: North America: United States: Government: Elections: President: 2008: Candidates: Clinton, Hillary","Regional: North America: United States: Government: Elections: President: 2008: Candidates: McCain, John",Regional: North America: United States: Government: Elections: President: 2008: News and Media,Regional: North America: United States: Government: Elections: President: 2012: Debates: Republican Primary,Regional: North America: United States: Government: Legislative Branch,Regional: North America: United States: Illinois: Government: Federal: US House of Representatives: Robin Kelly D-2,Regional: North America: United States: Maryland: Government: Federal: US House of Representatives: Chris Van Hollen D-8,Regional: North America: United States: New York: Government: Federal: US House of Representatives: Steve Israel D-03,Regional: North America: United States: North Carolina: Government: Federal: US Senate: Richard Burr R,"Regional: North America: United States: Society and Culture: Politics: Candidates and Campaigns: President: Candidates: Gingrich, Newt","Regional: North America: United States: Society and Culture: Politics: Candidates and Campaigns: President: Candidates: Romney, Mitt",Regional: North America: United States: Society and Culture: Politics: Issues: Election Reform: Term Limits,Regional: North America: United States: Society and Culture: Politics: Issues: Health Care Reform: Guides and Directories,Regional: North America: United States: Society and Culture: Politics: Issues: Health Care Reform: News and Media,Regional: North America: United States: Society and Culture: Politics: Issues: Tax Policy: News and Media,Regional: North America: United States: Texas: Government: Federal: US House of Representatives: Beto O'Rourke D-16,Regional: North America: United States: Virginia: Counties: Fairfax: News and Media,"Regional: North America: United States: Washington, DC: Neighborhoods","Regional: North America: United States: Washington, DC: Society and Culture: History: 20th Century","Society: History: By Region: North America: United States: Presidents: Clinton, William Jefferson: Controversies, Scandals, Allegations: Whitewater Investigation","Society: History: By Region: North America: United States: Presidents: Nixon, Richard Milhous: Watergate",Society: Issues: Family Planning: Emergency Contraception,Society: Issues: Health: Tobacco: Advocacy: Pro-Tobacco: Regulation: Lobbying: Critiques,Society: Issues: Science and Technology: Biotechnology: Cloning,Society: Issues: Territorial Disputes: Sudan: Darfur Conflict,Society: Issues: Warfare and Conflict: Specific Conflicts: War on Terrorism: Human Rights and Liberties,Society: Issues: Warfare and Conflict: Specific Conflicts: War on Terrorism: News and Media,Sports: Football: American: NFL: Washington Redskins: News and Media,"Sports: Resources: News and Media: Sportscasters: Cosell, Howard",Sports: Skating: Ice Skating: Skaters: Torvill and Dean,Sports: Winter Sports: Sledding: Bobsled,Kids and Teens: Health: Substance Abuse: Tobacco,Kids and Teens: News: Newspapers,"Kids and Teens: People and Society: Biography: Artists: Trudeau, Gary","Kids and Teens: People and Society: Biography: Presidents: Nixon, Richard Milhous: Watergate",Kids and Teens: School Time: Math: History,Kids and Teens: School Time: Science: Living Things: Genetics: Cloning,Kids and Teens: School Time: Social Studies: Economics,Kids and Teens: School Time: Social Studies: Geography: Caribbean: Cuba,"Kids and Teens: School Time: Social Studies: History: By Region: North America: United States: Presidents: Bush, George Walker","Kids and Teens: School Time: Social Studies: History: By Region: North America: United States: Presidents: Roosevelt, Franklin Delano",Kids and Teens: Your Family: Pets,Arts: Animation: Anime: Titles: S: Steamboy: Reviews,"Arts: Animation: Movies: Titles: Pagemaster, The","Arts: Art History: Artists: G: Gogh, Vincent van","Arts: Art History: Artists: N: Nevelson, Louise",Arts: Comics: Comic Strips and Panels: F: FoxTrot,Arts: Comics: Online: Anthologies,Arts: Entertainment: News and Media,"Arts: Literature: Authors: H: Hall, Donald","Arts: Literature: Authors: L: Lethem, Jonathan: Novels: Motherless Brooklyn","Arts: Literature: Authors: M: Mairs, Nancy","Arts: Literature: Authors: M: McCullers, Carson","Arts: Literature: Authors: P: Powell, Dawn","Arts: Literature: Authors: W: Weir, Alison: Reviews","Arts: Literature: Authors: W: Wright, James","Arts: Literature: Drama: 20th Century: Foote, Horton","Arts: Literature: Genres: Fantasy: Authors: L: Le Guin, Ursula K.","Arts: Literature: Genres: Fantasy: Authors: L: Le Guin, Ursula K.: Reviews",Arts: Literature: Poetry: Forms: Fixed Verse Forms: Pantoum,Arts: Literature: Reviews and Criticism,"Arts: Literature: World Literature: American: 19th Century: Twain, Mark: Biographies","Arts: Literature: World Literature: British: 20th Century: Hornby, Nick: Works: How to Be Good"
20,foodallergy.org,Food Allergy,202,2016-02-08,Yes,"Alexa Rank: 169382 (Global), 36279 (US)",Health: Conditions and Diseases: Allergies: Food,Home: Cooking: For Children,,,,,,,,,,,,,,,,,,,,,,,,,,,,,,,,,,,,,,,,,,,,,,,,,,,,,,,,,,,,,,,,,,,,,,,,,,,,,,,,,,,,,,,,,,,,,,,,,,
21,dictionary.reference.com,Dictionary.com,207,2016-02-08,Yes,"Alexa Rank: 435 (Global), 182 (US)",Kids and Teens: Games: Online: Word Games,Games: Puzzles: Crosswords: Solving Tools,Games: Video Games: Word Games: Browser Based,Reference: Dictionaries: Vocabulary Lists: Word-a-day,,,,,,,,,,,,,,,,,,,,,,,,,,,,,,,,,,,,,,,,,,,,,,,,,,,,,,,,,,,,,,,,,,,,,,,,,,,,,,,,,,,,,,,,,,,,,,,,
22,gawker.com,Gawker,228,2016-02-08,Yes,"Alexa Rank: 922 (Global), 208 (US)",Arts: Entertainment: Weblogs,Arts: Music: Styles: R: Rock: Electroclash: Bands and Artists: Fischerspooner,Regional: North America: United States: New York: Localities: N: New York City: News and Media: Weblogs,,,,,,,,,,,,,,,,,,,,,,,,,,,,,,,,,,,,,,,,,,,,,,,,,,,,,,,,,,,,,,,,,,,,,,,,,,,,,,,,,,,,,,,,,,,,,,,,,
23,reddit.com,Reddit,303,2016-02-08,Yes,"Alexa Rank: 33 (Global), 9 (US)",World: Tiếng Việt: Tin tức: Tiêu đề chọn lọc,Arts: Illustration: Specialized: Technical and Infographics,Arts: Music: Styles: R: Rock: Heavy Metal: Grindcore,"Computers: History: Pioneers: Stallman, Richard",Computers: Programming,Computers: Programming: Languages: C++: Resources,Computers: Programming: Languages: JavaScript,Computers: Programming: Languages: Rust,Computers: Software: Operating Systems: iOS,Games: Conventions: Video Games: BlizzCon,Games: Video Games: Roleplaying: Browser Based: Kingdom of Loathing,Games: Video Games: Roleplaying: D: Diablo Series: Diablo III,Games: Video Games: Roleplaying: Massive Multiplayer Online: Age of Wushu,Games: Video Games: Roleplaying: Massive Multiplayer Online: Blade and Soul,Games: Video Games: Roleplaying: T: Tales of Series,Games: Video Games: Simulation: God Games: Sim Games: SimCity Series: SimCity,Health: Conditions and Diseases: Eye Disorders: Cornea: Keratoconus,Health: Men's Health: Andropause,News: Directories: Headline Links: Collaborative,Recreation: Outdoors: Urban Exploration: Chats and Forums,Recreation: Tobacco: Electronic Cigarettes,Recreation: Tobacco: Hookah: Chats and Forums,Reference: Education: Colleges and Universities: North America: United States: Illinois: Shimer College,Reference: Education: Products and Services: Test Preparation: LSAT,Regional: North America: Canada: British Columbia: Localities: V: Vancouver: Society and Culture,"Society: Gay, Lesbian, and Bisexual: News and Media: Headlines",Society: Religion and Spirituality: Opposing Views: Christianity: Latter Day Saints,Sports: Baseball: Major League: Chats and Forums,Sports: Basketball: Professional: NBA: Toronto Raptors: Fan Pages,Sports: Boxing: Chats and Forums,Sports: Fantasy: Baseball,World: Esperanto: Novaĵoj,World: Norsk: Data: Internett: På verdensveven,World: Türkçe: Bilgisayar: İnternet: Web: Çevrimiçi Topluluklar,,,,,,,,,,,,,,,,,,,,,,,,,,,,,,,,,,,,,,,,,,,,,,,,,,,,,,,,,,,,,,,,,,
24,essence.com,Essence,320,2016-02-08,Yes,"Alexa Rank: 26662 (Global), 5614 (US)",Business: Consumer Goods and Services: Jewelry: Diamond: Wholesale and Distribution,Health: Animal: Alternative Medicine: Essences,Regional: Europe: United Kingdom: England: Essex: Brentwood: Health,Society: Ethnicity: African: African-American: Literature: Magazines,Society: Ethnicity: African: African-American: Women,World: Chinese Simplified: 商业: 投资: 股票与债券: 股票: 证券公司,World: Deutsch: Wirtschaft: Unternehmensberatung: Infobroker,World: Español: Regional: América: México: Economía y negocios: Textiles: Ropa,,,,,,,,,,,,,,,,,,,,,,,,,,,,,,,,,,,,,,,,,,,,,,,,,,,,,,,,,,,,,,,,,,,,,,,,,,,,,,,,,,,,,,,,,,,,
